Symbol,Name,Last Sale,Net Change,% Change,Market Cap,Country,IPO Year,Volume,Sector,Industry
JVA,Coffee Holding Co. Inc. Common Stock,$5.00,-0.19,-3.661%,28542995.00,United States,2005,85429,Consumer Staples,Packaged Foods
JYNT,The Joint Corp. Common Stock,$11.56,0.02,0.173%,173210520.00,United States,2014,38965,Miscellaneous,Multi-Sector Companies
KALA,KALA BIO Inc. Common Stock,$10.88,0.58,5.631%,50158312.00,United States,2017,113723,Health Care,Biotechnology: Pharmaceutical Preparations
KALU,Kaiser Aluminum Corporation Common Stock,$73.96,1.55,2.141%,1189868850.00,United States,,93734,Industrials,Metal Fabrications
KAVL,Kaival Brands Innovations Group Inc. Common Stock,$1.40,-0.03,-2.098%,9497541.00,United States,,157427,Consumer Discretionary,Other Consumer Services
KDLY,Kindly MD Inc. Common Stock,$1.4216,0.1716,13.728%,8497580.00,United States,2024,133236,Health Care,Medical/Nursing Services
KDLYW,Kindly MD Inc. Warrants,$0.30,0.10,50.00%,1793243.00,United States,2024,5582,Health Care,Medical/Nursing Services
KDP,Keurig Dr Pepper Inc. Common Stock,$31.56,0.66,2.136%,42809677162.00,United States,,7698746,Consumer Staples,Beverages (Production/Distribution)
KE,Kimball Electronics Inc. Common Stock,$16.67,0.12,0.725%,409326232.00,United States,,146042,Technology,Electrical Products
KELYA,Kelly Services Inc. Class A Common Stock,$13.44,0.00,0.00%,478596142.00,United States,,336540,Consumer Discretionary,Professional Services
KELYB,Kelly Services Inc. Class B Common Stock,$14.00,1.10,8.527%,498537648.00,United States,,123,Consumer Discretionary,Professional Services
KEQU,Kewaunee Scientific Corporation Common Stock,$65.50,-0.68,-1.028%,188103424.00,United States,,22650,Industrials,Medical Specialities
KFFB,Kentucky First Federal Bancorp Common Stock,$3.275,-0.005,-0.152%,26483992.00,United States,2005,1202,Finance,Savings Institutions
KFIIU,K&F Growth Acquisition Corp. II Unit,$10.01,-0.005,-0.05%,0.00,United States,2025,1363063,Finance,Blank Checks
KGEI,Kolibri Global Energy Inc. Common stock,$7.92,0.26,3.394%,283028843.00,United States,,73520,Energy,Oil & Gas Production
KHC,The Kraft Heinz Company Common Stock,$29.58,0.62,2.141%,35767393365.00,United States,,9258873,Consumer Staples,Packaged Foods
KIDS,OrthoPediatrics Corp. Common Stock,$24.11,-0.47,-1.912%,583846217.00,United States,2017,245545,Health Care,Medical/Dental Instruments
KINS,Kingstone Companies Inc. Common Stock,$17.32,-0.11,-0.631%,213886966.00,United States,,167980,Finance,Property-Casualty Insurers
KIRK,Kirkland's Inc. COMMONSTOCK,$1.555,0.015,0.974%,20398400.00,United States,2002,97696,Consumer Discretionary,Other Specialty Stores
KITT,Nauticus Robotics Inc. Common stock,$1.61,-0.13,-7.471%,10316035.00,United States,2021,4218843,Industrials,Industrial Machinery/Components
KITTW,Nauticus Robotics Inc. Warrant,$0.09,-0.0001,-0.111%,576673.00,United States,2021,159190,Industrials,Industrial Machinery/Components
KLAC,KLA Corporation Common Stock,$758.62,7.16,0.953%,100810543251.00,United States,1980,591826,Technology,Electronic Components
KLTO,Klotho Neurosciences Inc. Common Stock,$0.3392,0.0142,4.369%,7212584.00,United States,2022,68186,Health Care,Biotechnology: Biological Products (No Diagnostic Substances)
KLTOW,Klotho Neurosciences Inc. Warrant,$0.03,0.00,0.00%,637905.00,United States,2022,98040,Health Care,Biotechnology: Biological Products (No Diagnostic Substances)
KLTR,Kaltura Inc. Common Stock,$2.74,0.04,1.481%,410165174.00,United States,2021,324782,Technology,Computer Software: Prepackaged Software
KLXE,KLX Energy Services Holdings Inc. Common Stock,$4.85,-0.03,-0.615%,81772630.00,United States,,81997,Energy,Oilfield Services/Equipment
KNSA,Kiniksa Pharmaceuticals International plc Class A Ordinary Shares,$19.70,0.10,0.51%,1422370831.00,United States,2018,569501,Health Care,Biotechnology: Pharmaceutical Preparations
KOD,Kodiak Sciences Inc Common Stock,$5.34,0.00,0.00%,281010953.00,United States,2018,309776,Health Care,Biotechnology: Biological Products (No Diagnostic Substances)
KOPN,Kopin Corporation Common Stock,$1.84,0.06,3.371%,292193104.00,United States,1992,10556957,Technology,Semiconductors
KOSS,Koss Corporation Common Stock,$6.49,-0.45,-6.484%,60848910.00,United States,,143521,Consumer Staples,Consumer Electronics/Appliances
KPLT,Katapult Holdings Inc. Common Stock,$9.15,-0.21,-2.244%,40173249.00,United States,2019,3933,Consumer Discretionary,Diversified Commercial Services
KPLTW,Katapult Holdings Inc. Warrant,$0.01,0.00,0.00%,43905.00,United States,2019,26317,Consumer Discretionary,Diversified Commercial Services
KPRX,Kiora Pharmaceuticals Inc.  Common Stock,$3.26,-0.34,-9.444%,9782569.00,United States,,480155,Health Care,Biotechnology: Pharmaceutical Preparations
KPTI,Karyopharm Therapeutics Inc. Common Stock,$0.5981,-0.0248,-3.981%,74950606.00,United States,2013,1133686,Health Care,Biotechnology: Pharmaceutical Preparations
KRMD,KORU Medical Systems Inc. Common Stock (DE),$4.65,0.00,0.00%,213143464.00,United States,,197748,Health Care,Medical/Dental Instruments
KRNY,Kearny Financial Corp Common Stock,$7.55,0.12,1.615%,487576607.00,United States,2005,281796,Finance,Savings Institutions
KRON,Kronos Bio Inc. Common Stock,$0.9678,0.0203,2.142%,58397940.00,United States,2020,235727,Health Care,Biotechnology: Pharmaceutical Preparations
KROS,Keros Therapeutics Inc. Common Stock,$10.28,-0.21,-2.002%,416416165.00,United States,2020,994531,Health Care,Biotechnology: Pharmaceutical Preparations
KRRO,Korro Bio Inc. Common Stock,$30.34,-1.89,-5.864%,284233069.00,United States,2019,94080,Health Care,Biotechnology: Pharmaceutical Preparations
KRT,Karat Packaging Inc. Common Stock,$30.32,-0.04,-0.132%,607130864.00,United States,2021,12321,Industrials,Plastic Products
KRUS,Kura Sushi USA Inc. Class A Common Stock,$72.99,-2.91,-3.834%,880706975.00,United States,2019,227199,Consumer Discretionary,Restaurants
KRYS,Krystal Biotech Inc. Common Stock,$149.92,-4.61,-2.983%,4311781356.00,United States,2017,115357,Health Care,Biotechnology: Biological Products (No Diagnostic Substances)
KSCP,Knightscope Inc. Class A Common Stock,$9.79,-0.66,-6.316%,37382626.00,United States,2022,247376,Telecommunications,Telecommunications Equipment
KTCC,Key Tronic Corporation Common Stock,$3.26,0.06,1.875%,35083699.00,United States,1983,23315,Technology,Electrical Products
KTOS,Kratos Defense & Security Solutions Inc. Common Stock,$32.07,-1.02,-3.083%,4844939524.00,United States,,1718678,Industrials,Military/Government/Technical
KTTA,Pasithea Therapeutics Corp. Common Stock,$1.41,-0.23,-14.024%,1785662.00,United States,2021,322418,Health Care,Biotechnology: Pharmaceutical Preparations
KTTAW,Pasithea Therapeutics Corp. Warrant,$0.0278,-0.0041,-12.853%,35207.00,United States,2021,3653,Health Care,Biotechnology: Pharmaceutical Preparations
KURA,Kura Oncology Inc. Common Stock,$8.34,-0.45,-5.119%,648549675.00,United States,,1928344,Health Care,Biotechnology: Pharmaceutical Preparations
KVAC,Keen Vision Acquisition Corporation Ordinary Shares,$11.11,0.00,0.00%,0.00,United States,2023,22,,
KVACU,Keen Vision Acquisition Corporation Units,$11.06,-0.05,-0.45%,0.00,United States,2023,100,,
KVACW,Keen Vision Acquisition Corporation Warrant,$0.0532,-0.0248,-31.795%,0.00,United States,2023,2224,,
KVHI,KVH Industries Inc. Common Stock,$6.00,-0.03,-0.498%,118794732.00,United States,1996,10644,Technology,Radio And Television Broadcasting And Communications Equipment
KYMR,Kymera Therapeutics Inc. Common Stock,$34.41,-1.63,-4.523%,2228573078.00,United States,2020,660751,Health Care,Biotechnology: Biological Products (No Diagnostic Substances)
KYTX,Kyverna Therapeutics Inc. Common Stock,$2.93,-0.08,-2.658%,126492823.00,United States,2024,221417,Health Care,Biotechnology: Biological Products (No Diagnostic Substances)
KZR,Kezar Life Sciences Inc. Common Stock,$6.10,0.02,0.329%,44506954.00,United States,2018,27309,Health Care,Biotechnology: Pharmaceutical Preparations
LAB,Standard BioTools Inc. Common Stock,$1.305,-0.005,-0.382%,485797731.00,United States,2011,3060643,Industrials,Biotechnology: Laboratory Analytical Instruments
LAKE,Lakeland Industries Inc. Common Stock,$24.52,1.23,5.281%,181585410.00,United States,1986,88925,Health Care,Industrial Specialties
LAMR,Lamar Advertising Company Class A Common Stock,$126.75,-1.43,-1.116%,12973852037.00,United States,1996,347748,Real Estate,Real Estate Investment Trusts
LANC,Lancaster Colony Corporation Common Stock,$190.67,4.09,2.192%,5257153240.00,United States,,117785,Consumer Staples,Packaged Foods
LAND,Gladstone Land Corporation Common Stock,$10.97,0.27,2.523%,396945698.00,United States,2013,1031534,Real Estate,Real Estate Investment Trusts
LANDM,Gladstone Land Corporation 5.00% Series D Cumulative Term Preferred Stock,$24.79,0.017,0.069%,897017672.00,United States,,232,Real Estate,Real Estate Investment Trusts
LANDO,Gladstone Land Corporation 6.00% Series B Cumulative Redeemable Preferred Stock,$20.50,-0.19,-0.918%,741785489.00,United States,,13584,Real Estate,Real Estate Investment Trusts
LANDP,Gladstone Land Corporation 6.00% Series C Cumulative Redeemable Preferred Stock,$20.40,-0.0148,-0.072%,738167023.00,United States,,55424,Real Estate,Real Estate Investment Trusts
LARK,Landmark Bancorp Inc. Common Stock,$24.93,0.17,0.687%,144002710.00,United States,,3108,Finance,Major Banks
LASE,Laser Photonics Corporation Common Stock,$3.99,-0.09,-2.206%,55191256.00,United States,2022,256326,Miscellaneous,Industrial Machinery/Components
LASR,nLIGHT Inc. Common Stock,$10.97,-0.08,-0.724%,531270035.00,United States,2018,208175,Technology,Semiconductors
LAUR,Laureate Education Inc. Common Stock,$19.91,0.07,0.353%,3000136976.00,United States,2017,520029,Real Estate,Other Consumer Services
LAZR,Luminar Technologies Inc.  Class A Common Stock,$5.60,0.04,0.719%,186458227.00,United States,2019,1137134,Consumer Discretionary,Auto Parts:O.E.M.
LBRDA,Liberty Broadband Corporation Class A Common Stock,$77.93,1.53,2.003%,11132151965.00,United States,,53941,Telecommunications,Cable & Other Pay Television Services
LBRDK,Liberty Broadband Corporation Class C Common Stock,$78.53,1.42,1.842%,11217860822.00,United States,,390273,Telecommunications,Cable & Other Pay Television Services
LBRDP,Liberty Broadband Corporation Series A Cumulative Redeemable Preferred Stock,$24.9262,-0.0188,-0.075%,3560660161.00,United States,,5364,Telecommunications,Cable & Other Pay Television Services
LCID,Lucid Group Inc. Common Stock,$2.69,-0.08,-2.888%,8101436846.00,United States,,40921536,Consumer Discretionary,Auto Manufacturing
LCNB,LCNB Corporation Common Stock,$15.73,0.13,0.833%,221955601.00,United States,,12245,Finance,Major Banks
LCUT,Lifetime Brands Inc. Common Stock,$5.02,-0.09,-1.761%,111226810.00,United States,1991,59095,Consumer Discretionary,Industrial Machinery/Components
LDTC,LeddarTech Holdings Inc. Common Shares,$0.92,0.00,0.00%,27787382.00,United States,2021,250634,Technology,Computer Software: Prepackaged Software
LDTCW,LeddarTech Holdings Inc. Warrants,$0.0873,0.0073,9.125%,2636781.00,United States,2021,1663,Technology,Computer Software: Prepackaged Software
LDWY,Lendway Inc. Common Stock (DE),$4.1001,-0.1499,-3.527%,7255533.00,United States,,224,Consumer Discretionary,Advertising
LE,Lands' End Inc. Common Stock,$11.56,0.14,1.226%,357546627.00,United States,,74459,Consumer Discretionary,Clothing/Shoe/Accessory Stores
LECO,Lincoln Electric Holdings Inc. Common Shares,$193.50,0.50,0.259%,10918392881.00,United States,,184167,Industrials,Industrial Machinery/Components
LEE,Lee Enterprises Incorporated Common Stock,$11.56,-0.26,-2.20%,71567255.00,United States,,13944,Consumer Discretionary,Newspapers/Magazines
LEGH,Legacy Housing Corporation Common Stock (TX),$28.07,0.77,2.821%,678123790.00,United States,2018,273789,Consumer Discretionary,Homebuilding
LEGN,Legend Biotech Corporation American Depositary Shares,$34.63,-1.10,-3.079%,6299579142.00,United States,2020,985933,Health Care,Biotechnology: Pharmaceutical Preparations
LENZ,LENZ Therapeutics Inc. Common Stock,$24.88,-0.12,-0.48%,684222193.00,United States,2021,109648,Health Care,Biotechnology: Biological Products (No Diagnostic Substances)
LESL,Leslie's Inc. Common Stock,$1.75,0.145,9.034%,324147868.00,United States,2020,9053398,Consumer Discretionary,Other Specialty Stores
LFCR,Lifecore Biomedical Inc. Common Stock,$5.72,-0.15,-2.555%,211784893.00,United States,,85305,Health Care,Biotechnology: Pharmaceutical Preparations
LFMD,LifeMD Inc. Common Stock,$6.55,-0.34,-4.935%,283694366.00,United States,,1321309,Health Care,Medical/Nursing Services
LFMDP,LifeMD Inc. 8.875% Series A Cumulative Perpetual Preferred Stock,$22.57,0.0247,0.11%,977554481.00,United States,,937,Health Care,Medical/Nursing Services
LFST,LifeStance Health Group Inc. Common Stock,$7.94,-0.12,-1.489%,3038162362.00,United States,2021,552319,Health Care,Medical/Nursing Services
LFUS,Littelfuse Inc. Common Stock,$239.72,5.00,2.13%,5948576768.00,United States,,194030,Energy,Electrical Products
LFVN,Lifevantage Corporation Common Stock (Delaware),$19.685,-1.035,-4.995%,247071966.00,United States,,256797,Health Care,Biotechnology: Pharmaceutical Preparations
LGIH,LGI Homes Inc. Common Stock,$85.69,1.01,1.193%,2014870787.00,United States,2013,196584,Consumer Discretionary,Homebuilding
LGMK,LogicMark Inc. Common Stock (NV),$0.6977,-0.1223,-14.915%,1289958.00,United States,,191378,Health Care,Industrial Specialties
LGND,Ligand Pharmaceuticals Incorporated Common Stock,$112.77,-1.35,-1.183%,2130831213.00,United States,,59683,Health Care,Biotechnology: Pharmaceutical Preparations
LGTY,Logility Supply Chain Solutions Inc. Common Stock,$14.09,0.01,0.071%,474552031.00,United States,,302733,Technology,Computer Software: Prepackaged Software
LGVN,Longeveron Inc. Class A Common Stock,$1.46,-0.02,-1.351%,21661692.00,United States,2021,97767,Health Care,Biotechnology: Pharmaceutical Preparations
LIDR,AEye Inc. Class A Common Stock,$0.82,-0.045,-5.202%,7489181.00,United States,2021,766100,Consumer Discretionary,Auto Parts:O.E.M.
LIDRW,AEye Inc. Warrant,$0.0704,-0.0012,-1.676%,642974.00,United States,2021,15559,Consumer Discretionary,Auto Parts:O.E.M.
LIEN,Chicago Atlantic BDC Inc. Common Stock,$11.63,0.00,0.00%,265400868.00,United States,2022,5434,Finance,Finance: Consumer Services
LIF,Life360 Inc. Common Stock,$45.01,-0.18,-0.398%,3360742496.00,United States,2024,93374,,
LILA,Liberty Latin America Ltd. Class A Common Stock,$6.89,0.23,3.453%,1355263000.00,United States,,377756,Telecommunications,Cable & Other Pay Television Services
LILAK,Liberty Latin America Ltd. Class C Common Stock,$6.87,0.23,3.464%,1351329000.00,United States,,859690,Telecommunications,Cable & Other Pay Television Services
LIN,Linde plc Ordinary Shares,$460.74,-0.12,-0.026%,219384992228.00,United States,,1587763,Industrials,Major Chemicals
LINC,Lincoln Educational Services Corporation Common Stock,$17.49,0.05,0.287%,550570631.00,United States,2005,72014,Real Estate,Other Consumer Services
LIND,Lindblad Expeditions Holdings Inc. Common Stock,$12.28,-0.02,-0.163%,669307450.00,United States,2013,174177,Consumer Discretionary,Transportation Services
LINE,Lineage Inc. Common Stock,$57.50,0.15,0.262%,13133674475.00,United States,2024,599120,Real Estate,Real Estate Investment Trusts
LINK,Interlink Electronics Inc. Common Stock,$7.22,0.20,2.849%,71219625.00,United States,,23963,Technology,Computer peripheral equipment
LION,Lionsgate Studios Corp. Common Shares,$8.74,0.01,0.115%,2523073898.00,United States,,195631,Consumer Discretionary,Movies/Entertainment
LIPO,Lipella Pharmaceuticals Inc. Common Stock,$4.32,1.27,41.639%,5222530.00,United States,2022,39873741,Health Care,Biotechnology: Pharmaceutical Preparations
LITE,Lumentum Holdings Inc. Common Stock,$79.60,-2.33,-2.844%,5508320000.00,United States,,2520085,Telecommunications,Telecommunications Equipment
LIVE,Live Ventures Incorporated Common Stock,$9.00,-0.25,-2.703%,27957879.00,United States,,4050,Consumer Discretionary,Other Specialty Stores
LIXT,Lixte Biotechnology Holdings Inc. Common Stock,$1.93,-0.35,-15.351%,4341130.00,United States,,1791127,Health Care,Biotechnology: Pharmaceutical Preparations
LIXTW,Lixte Biotechnology Holdings Inc. Warrants,$0.0398,0.0029,7.859%,89522.00,United States,,3945,Health Care,Biotechnology: Pharmaceutical Preparations
LKFN,Lakeland Financial Corporation Common Stock,$69.34,1.31,1.926%,1768591865.00,United States,,117357,Finance,Major Banks
LKQ,LKQ Corporation Common Stock,$37.69,0.34,0.91%,9797889234.00,United States,2003,1766120,Consumer Discretionary,Motor Vehicles
LLYVA,Liberty Media Corporation Series A Liberty Live Common Stock,$74.90,0.44,0.591%,6871192753.00,United States,,89635,Industrials,Broadcasting
LLYVK,Liberty Media Corporation Series C Liberty Live Common Stock,$76.51,0.48,0.631%,7018891289.00,United States,,263658,Industrials,Broadcasting
LMAT,LeMaitre Vascular Inc. Common Stock,$96.94,-1.50,-1.524%,2179600996.00,United States,2006,138615,Health Care,Medical/Dental Instruments
LMB,Limbach Holdings Inc. Common Stock,$94.01,-4.33,-4.403%,1059784225.00,United States,,84836,Consumer Discretionary,Engineering & Construction
LMFA,LM Funding America Inc. Common Stock,$1.82,-0.06,-3.191%,6182616.00,United States,2015,24386,Finance,Finance: Consumer Services
LMNR,Limoneira Co Common Stock,$23.00,0.23,1.01%,415911116.00,United States,,26994,Consumer Staples,Farming/Seeds/Milling
LNKB,LINKBANCORP Inc. Common Stock,$7.51,0.17,2.316%,280651081.00,United States,,19180,Finance,Major Banks
LNSR,LENSAR Inc. Common Stock,$10.24,-0.77,-6.994%,118935624.00,United States,,98220,Health Care,Medical/Dental Instruments
LNT,Alliant Energy Corporation Common Stock,$60.31,0.44,0.735%,15475497873.00,United States,,1523662,Utilities,Power Generation
LNTH,Lantheus Holdings Inc. Common Stock,$81.92,-4.99,-5.742%,5695638815.00,United States,2015,1371895,Health Care,Biotechnology: In Vitro & In Vivo Diagnostic Substances
LNW,Light & Wonder Inc. Common Stock,$94.36,-3.31,-3.389%,8332732123.00,United States,,1005552,Technology,EDP Services
LNZA,LanzaTech Global Inc. Common Stock,$0.701,-0.0642,-8.39%,138645221.00,United States,2021,2587790,Industrials,Major Chemicals
LNZAW,LanzaTech Global Inc. Warrant,$0.172,0.0094,5.781%,34018513.00,United States,2021,85797,Industrials,Major Chemicals
LOAN,Manhattan Bridge Capital Inc,$5.62,-0.05,-0.882%,64285219.00,United States,,7072,Real Estate,Real Estate Investment Trusts
LOCO,El Pollo Loco Holdings Inc. Common Stock,$12.26,0.04,0.327%,367054911.00,United States,2014,239294,Consumer Discretionary,Restaurants
LOGC,ContextLogic Inc. Class A Common Stock,$7.79,0.02,0.257%,204760578.00,United States,2020,119199,Consumer Discretionary,Catalog/Specialty Distribution
LOGI,Logitech International S.A. Ordinary Shares,$99.85,-0.68,-0.676%,15849960344.00,United States,1997,351292,Technology,Computer peripheral equipment
LOPE,Grand Canyon Education Inc. Common Stock,$182.00,0.20,0.11%,5304532142.00,United States,2008,184476,Real Estate,Other Consumer Services
LOVE,The Lovesac Company Common Stock,$22.24,-0.21,-0.935%,343226717.00,United States,2018,172968,Consumer Discretionary,Other Specialty Stores
LPAA,Launch One Acquisition Corp. Class A Ordinary shares,$10.10,-0.01,-0.099%,0.00,United States,2024,53378,,
LPAAU,Launch One Acquisition Corp. Unit,$10.22,0.02,0.196%,0.00,United States,2024,6071,Finance,Blank Checks
LPAAW,Launch One Acquisition Corp. Warrant,$0.16,0.00,0.00%,0.00,United States,2024,560,Finance,Blank Checks
LPBB,Launch Two Acquisition Corp. Class A Ordinary Shares,$10.01,-0.03,-0.299%,0.00,United States,2024,762772,,
LPBBU,Launch Two Acquisition Corp. Unit,$10.10,0.03,0.298%,0.00,United States,2024,5183,Finance,Blank Checks
LPBBW,Launch Two Acquisition Corp. Warrant,$0.19,0.00,0.00%,0.00,United States,2024,111,,
LPCN,Lipocine Inc. Common Stock,$3.41,-0.09,-2.571%,18236475.00,United States,,8876,Health Care,Biotechnology: Pharmaceutical Preparations
LPLA,LPL Financial Holdings Inc. Common Stock,$362.42,-3.68,-1.005%,27137857021.00,United States,2010,880973,Finance,Investment Bankers/Brokers/Service
LPRO,Open Lending Corporation Common Stock,$6.00,-0.18,-2.913%,716100006.00,United States,,284321,Finance,Finance: Consumer Services
LPSN,LivePerson Inc. Common Stock,$1.29,-0.06,-4.444%,117195525.00,United States,2000,1479684,Technology,Computer Software: Prepackaged Software
LPTH,LightPath Technologies Inc. Class A Common Stock,$3.46,0.04,1.17%,137240509.00,United States,1996,179521,Technology,Semiconductors
LPTX,Leap Therapeutics Inc. Common Stock,$0.5396,0.0021,0.391%,20676337.00,United States,,1041169,Health Care,Biotechnology: Pharmaceutical Preparations
LQDA,Liquidia Corporation Common Stock,$16.26,0.04,0.247%,1376191457.00,United States,2018,753082,Health Care,Biotechnology: Pharmaceutical Preparations
LQDT,Liquidity Services Inc. Common Stock,$34.34,0.54,1.598%,1065889837.00,United States,2006,581628,Consumer Discretionary,Business Services
LRCX,Lam Research Corporation Common Stock,$83.26,-0.47,-0.561%,106877698120.00,United States,1984,8902642,Technology,Industrial Machinery/Components
LRFC,Logan Ridge Finance Corporation Common Stock,$24.85,-0.105,-0.421%,66261357.00,United States,2013,13844,Finance,Finance: Consumer Services
LRHC,La Rosa Holdings Corp. Common Stock,$0.2408,-0.0342,-12.436%,4864375.00,United States,2023,2142155,Finance,Real Estate
LRMR,Larimar Therapeutics Inc. Common Stock,$3.15,-0.22,-6.528%,200990878.00,United States,2014,505678,Health Care,Biotechnology: Pharmaceutical Preparations
LSBK,Lake Shore Bancorp Inc. Common Stock,$15.82,0.27,1.736%,90759910.00,United States,2006,5313,Finance,Savings Institutions
LSCC,Lattice Semiconductor Corporation Common Stock,$58.64,4.17,7.656%,8090630699.00,United States,,7021783,Technology,Semiconductors
LSEA,Landsea Homes Corporation Common Stock,$8.22,0.18,2.239%,298245298.00,United States,2018,196829,Consumer Discretionary,Homebuilding
LSEAW,Landsea Homes Corporation Warrant,$0.1179,0.0079,7.182%,4277752.00,United States,2018,11404,Consumer Discretionary,Homebuilding
LSH,Lakeside Holding Limited Common Stock,$1.99,-0.03,-1.485%,14925000.00,United States,2024,184503,,
LSTA,Lisata Therapeutics Inc. Common Stock,$2.51,-0.10,-3.831%,21071207.00,United States,,14055,Health Care,Misc Health and Biotechnology Services
LSTR,Landstar System Inc. Common Stock,$161.17,1.12,0.70%,5694325152.00,United States,1993,246381,Industrials,Trucking Freight/Courier Services
LTBR,Lightbridge Corporation Common Stock,$10.84,-0.83,-7.112%,170913218.00,United States,,2971585,Consumer Discretionary,Professional Services
LTRN,Lantern Pharma Inc. Common Stock,$4.76,-0.29,-5.743%,51335291.00,United States,2020,50748,Health Care,Biotechnology: Pharmaceutical Preparations
LTRX,Lantronix Inc. Common Stock,$3.01,-0.11,-3.526%,116756889.00,United States,2000,643911,Telecommunications,Computer Communications Equipment
LTRY,Lottery.com Inc. Common Stock,$2.21,0.97,78.226%,23506320.00,United States,2023,56145297,Technology,Computer Software: Prepackaged Software
LTRYW,Lottery.com Inc. Warrants,$0.02,0.0014,7.527%,212727.00,United States,2023,1938687,Technology,Computer Software: Prepackaged Software
LUCD,Lucid Diagnostics Inc. Common Stock,$1.28,-0.02,-1.538%,75958373.00,United States,2021,1003349,Health Care,Medical/Dental Instruments
LUCY,Innovative Eyewear Inc. Common Stock,$4.90,-0.18,-3.543%,11967015.00,United States,2022,21492,Health Care,Ophthalmic Goods
LUCYW,Innovative Eyewear Inc. Series A Warrants 8/16/27,$0.057,0.002,3.636%,139208.00,United States,2022,9899,Health Care,Ophthalmic Goods
LUNG,Pulmonx Corporation Common Stock,$6.83,0.15,2.246%,269702214.00,United States,2020,320480,Health Care,Medical/Dental Instruments
LUNR,Intuitive Machines Inc. Class A Common Stock,$18.14,-1.79,-8.981%,2545890843.00,United States,2021,10870027,Industrials,Industrial Machinery/Components
LUNRW,Intuitive Machines Inc. Warrants,$6.72,-1.65,-19.713%,943130456.00,United States,2021,653337,Industrials,Industrial Machinery/Components
LVLU,Lulu's Fashion Lounge Holdings Inc. Common Stock,$0.8499,-0.0064,-0.747%,35722094.00,United States,2021,33883,Consumer Discretionary,Catalog/Specialty Distribution
LVO,LiveOne Inc. Common Stock,$1.18,-0.02,-1.667%,112886692.00,United States,,325231,Consumer Discretionary,Restaurants
LWAY,Lifeway Foods Inc. Common Stock,$21.49,0.15,0.703%,318405940.00,United States,,67021,Consumer Staples,Packaged Foods
LWLG,Lightwave Logic Inc. Common Stock,$1.59,-0.12,-7.018%,194573040.00,United States,,640491,Industrials,Containers/Packaging
LXEO,Lexeo Therapeutics Inc. Common Stock,$4.25,-0.37,-8.009%,140530275.00,United States,2023,316528,Health Care,Biotechnology: Biological Products (No Diagnostic Substances)
LXRX,Lexicon Pharmaceuticals Inc. Common Stock,$0.695,-0.0558,-7.432%,251237145.00,United States,,4524654,Health Care,Biotechnology: Pharmaceutical Preparations
LYEL,Lyell Immunopharma Inc. Common Stock,$0.5448,-0.0087,-1.572%,152119391.00,United States,2021,2221733,Health Care,Biotechnology: Pharmaceutical Preparations
LYFT,Lyft Inc. Class A Common Stock,$14.39,-0.73,-4.828%,5969214443.00,United States,2019,57488472,Consumer Discretionary,Business Services
LYRA,Lyra Therapeutics Inc. Common Stock,$0.20,0.007,3.627%,13091530.00,United States,2020,1613719,Health Care,Medical/Dental Instruments
LYTS,LSI Industries Inc. Common Stock,$20.60,-0.39,-1.858%,616380531.00,United States,1985,138738,Consumer Discretionary,Building Products
LZ,LegalZoom.com Inc. Common Stock,$9.30,0.08,0.868%,1607246553.00,United States,2021,2566342,Technology,EDP Services
MACI,Melar Acquisition Corp. I Class A Ordinary Shares,$10.15,0.01,0.099%,0.00,United States,2024,28192,,
MACIU,Melar Acquisition Corp. I Unit,$10.24,0.00,0.00%,0.00,United States,2024,117,,
MACIW,Melar Acquisition Corp. I Warrant,$0.1475,0.0075,5.357%,0.00,United States,2024,157,,
