Symbol,Name,Last Sale,Net Change,% Change,Market Cap,Country,IPO Year,Volume,Sector,Industry
PYCR,Paycor HCM Inc. Common Stock,$22.17,-0.01,-0.045%,4029884087.00,United States,2021,1132562,Technology,Computer Software: Prepackaged Software
PYPL,PayPal Holdings Inc. Common Stock,$76.21,-2.03,-2.595%,75390167267.00,United States,,15755182,Consumer Discretionary,Business Services
PYXS,Pyxis Oncology Inc. Common Stock,$1.27,-0.06,-4.511%,75521476.00,United States,2021,1096301,Health Care,Biotechnology: Pharmaceutical Preparations
PZZA,Papa John's International Inc. Common Stock,$41.76,3.12,8.075%,1363114176.00,United States,1993,3642222,Consumer Discretionary,Restaurants
QCOM,QUALCOMM Incorporated Common Stock,$171.99,0.63,0.368%,190220940000.00,United States,1991,6586134,Technology,Radio And Television Broadcasting And Communications Equipment
QCRH,QCR Holdings Inc. Common Stock,$77.90,0.67,0.868%,1314089725.00,United States,,86901,Finance,Major Banks
QDEL,QuidelOrtho Corporation Common Stock,$41.47,-1.42,-3.311%,2789136054.00,United States,,1107585,Health Care,Biotechnology: In Vitro & In Vivo Diagnostic Substances
QETA,Quetta Acquisition Corporation Common Stock,$10.62,-0.01,-0.094%,0.00,United States,2023,50011,Finance,Blank Checks
QETAR,Quetta Acquisition Corporation Right,$1.75,-0.24,-12.06%,0.00,United States,2023,15784,Finance,Blank Checks
QIPT,Quipt Home Medical Corp. Common Shares,$2.95,-0.07,-2.318%,127119255.00,United States,,481308,Health Care,Misc Health and Biotechnology Services
QLGN,Qualigen Therapeutics Inc. Common Stock,$3.23,0.01,0.311%,2378672.00,United States,2015,43155,Health Care,Biotechnology: Pharmaceutical Preparations
QLYS,Qualys Inc. Common Stock,$137.32,-0.38,-0.276%,5024600869.00,United States,2012,260601,Technology,Computer Software: Prepackaged Software
QMCO,Quantum Corporation Common Stock,$17.81,-1.19,-6.263%,86351464.00,United States,,427467,Technology,Electronic Components
QNCX,Quince Therapeutics Inc. Common Stock,$1.40,-0.03,-2.098%,61602300.00,United States,2019,64495,Health Care,Biotechnology: Biological Products (No Diagnostic Substances)
QNST,QuinStreet Inc. Common Stock,$23.18,0.13,0.564%,1308942148.00,United States,2010,617795,Consumer Discretionary,Business Services
QQQX,Nuveen NASDAQ 100 Dynamic Overwrite Fund Shares of Beneficial Interest,$26.99,0.04,0.148%,0.00,United States,,102550,Finance,Finance Companies
QRHC,Quest Resource Holding Corporation Common Stock,$5.07,0.00,0.00%,104379512.00,United States,,69186,Utilities,Environmental Services
QRTEA,Qurate Retail Inc. Series A Common Stock,$0.3599,0.0049,1.38%,142862314.00,United States,,689752,Consumer Discretionary,Catalog/Specialty Distribution
QRTEB,Qurate Retail Inc. Series B Common Stock,$2.33,0.17,7.87%,924893556.00,United States,,2032,Consumer Discretionary,Catalog/Specialty Distribution
QRTEP,Qurate Retail Inc. 8.0% Fixed Rate Cumulative Redeemable Preferred Stock,$37.10,0.70,1.923%,14726845890.00,United States,,24628,Consumer Discretionary,Catalog/Specialty Distribution
QRVO,Qorvo Inc. Common Stock,$76.66,-0.60,-0.777%,7159801141.00,United States,,1187392,Technology,Semiconductors
QSI,Quantum-Si Incorporated Class A Common Stock,$1.92,-0.08,-4.00%,274008676.00,United States,2020,8495239,Industrials,Industrial Machinery/Components
QSIAW,Quantum-Si Incorporated Warrant,$0.78,-0.02,-2.50%,111316025.00,United States,2020,4839,Industrials,Industrial Machinery/Components
QTRX,Quanterix Corporation Common Stock,$7.88,0.05,0.639%,303571689.00,United States,2017,722669,Industrials,Biotechnology: Laboratory Analytical Instruments
QTTB,Q32 Bio Inc. Common Stock,$2.88,-0.30,-9.434%,35080419.00,United States,2018,851027,Health Care,Biotechnology: Pharmaceutical Preparations
QUBT,Quantum Computing Inc. Common Stock,$7.87,-0.84,-9.644%,779810566.00,United States,,13146059,Technology,Computer Software: Prepackaged Software
QUIK,QuickLogic Corporation Common Stock,$6.84,-0.47,-6.43%,100596372.00,United States,1999,201773,Technology,Semiconductors
RAIL,FreightCar America Inc. Common Stock,$12.70,-0.35,-2.682%,239953444.00,United States,2005,114022,Industrials,Railroads
RAIN,Rain Enhancement Technologies Holdco Inc. Class A Common Stock,$3.29,0.06,1.858%,21800728.00,United States,,159877,Technology,Industrial Machinery/Components
RAINW,Rain Enhancement Technologies Holdco Inc. Warrants,$0.125,-0.0089,-6.647%,828295.00,United States,,32262,Technology,Industrial Machinery/Components
RAND,Rand Capital Corporation Common Stock,$24.03,0.23,0.966%,62021935.00,United States,,14448,Finance,Finance: Consumer Services
RANG,Range Capital Acquisition Corp. Ordinary Shares,$9.96,0.00,0.00%,0.00,United States,2025,435752,,
RANGR,Range Capital Acquisition Corp. Rights,$0.2274,0.00,0.00%,0.00,United States,2025,24,,
RANGU,Range Capital Acquisition Corp. Units,$10.1499,0.0099,0.098%,0.00,United States,2024,22661,,
RANI,Rani Therapeutics Holdings Inc. Class A Common Stock,$1.41,-0.01,-0.704%,80777042.00,United States,2021,692368,Health Care,Biotechnology: Pharmaceutical Preparations
RAPP,Rapport Therapeutics Inc. Common Stock,$15.74,-0.69,-4.20%,575713433.00,United States,2024,116029,Health Care,Biotechnology: Pharmaceutical Preparations
RAPT,RAPT Therapeutics Inc. Common Stock,$1.17,0.02,1.739%,40901156.00,United States,2019,549819,Health Care,Biotechnology: Pharmaceutical Preparations
RARE,Ultragenyx Pharmaceutical Inc. Common Stock,$43.58,-1.20,-2.68%,4024363199.00,United States,2014,571652,Health Care,Biotechnology: Pharmaceutical Preparations
RAVE,Rave Restaurant Group Inc. Common Stock,$2.48,0.10,4.202%,36484684.00,United States,,22633,Consumer Discretionary,Food Distributors
RBB,RBB Bancorp Common Stock,$18.47,0.21,1.15%,326797394.00,United States,2017,22288,Finance,Major Banks
RBBN,Ribbon Communications Inc. Common Stock,$4.34,0.07,1.639%,761165202.00,United States,,647596,Technology,EDP Services
RBCAA,Republic Bancorp Inc. Class A Common Stock,$68.07,1.49,2.238%,1323678193.00,United States,1998,17458,Finance,Major Banks
RBKB,Rhinebeck Bancorp Inc. Common Stock,$10.04,0.0299,0.299%,111319574.00,United States,2019,8530,Finance,Banks
RCAT,Red Cat Holdings Inc. Common Stock,$9.615,-1.135,-10.558%,770745919.00,United States,,7667667,Technology,Computer Software: Prepackaged Software
RCEL,Avita Medical Inc. Common Stock,$8.70,-0.10,-1.136%,228093372.00,United States,,84784,Health Care,Medical/Dental Instruments
RCKT,Rocket Pharmaceuticals Inc. Common Stock,$9.88,-0.23,-2.275%,900632000.00,United States,2015,2433170,Health Care,Biotechnology: Pharmaceutical Preparations
RCKTW,Rocket Pharmaceuticals Inc. Warrant,$0.0774,-0.0074,-8.726%,7055558.00,United States,,1104,Health Care,Biotechnology: Pharmaceutical Preparations
RCKY,Rocky Brands Inc. Common Stock,$23.81,0.41,1.752%,177475311.00,United States,1993,19108,Consumer Discretionary,Shoe Manufacturing
RCMT,RCM Technologies Inc. Common Stock,$20.19,0.17,0.849%,153383995.00,United States,,31868,Consumer Discretionary,Professional Services
RDFN,Redfin Corporation Common Stock,$7.95,-0.38,-4.562%,985644768.00,United States,2017,4926051,Finance,Real Estate
RDI,Reading International Inc Class A Common Stock,$1.55,0.00,0.00%,34760585.00,United States,,49570,Consumer Discretionary,Movies/Entertainment
RDIB,Reading International Inc Class B Common Stock,$6.90,0.16,2.374%,154740670.00,United States,,179,Consumer Discretionary,Movies/Entertainment
RDNT,RadNet Inc. Common Stock,$61.78,-0.57,-0.914%,4573371812.00,United States,,376522,Health Care,Medical Specialities
RDUS,Radius Recycling Inc. Class A Common Stock,$13.09,0.04,0.307%,368553977.00,United States,,204053,Consumer Discretionary,Industrial Specialties
RDVT,Red Violet Inc. Common Stock ,$39.93,-0.39,-0.967%,550700664.00,United States,,89533,Technology,Computer Software: Prepackaged Software
RDZN,Roadzen Inc. Ordinary Shares,$1.29,0.10,8.403%,88288669.00,United States,2022,233305,Finance,Specialty Insurers
RDZNW,Roadzen Inc. Warrants,$0.0655,0.0001,0.153%,4482874.00,United States,2022,151371,Finance,Specialty Insurers
REAL,The RealReal Inc. Common Stock,$7.67,-0.36,-4.483%,841331473.00,United States,2019,4336857,Consumer Discretionary,Other Specialty Stores
REBN,Reborn Coffee Inc. Common Stock,$4.15,-0.20,-4.598%,15241141.00,United States,2022,416419,Consumer Discretionary,Restaurants
REFI,Chicago Atlantic Real Estate Finance Inc. Common Stock,$15.89,0.17,1.081%,311991919.00,United States,2021,147528,Real Estate,Real Estate Investment Trusts
REFR,Research Frontiers Incorporated Common Stock,$1.56,0.16,11.429%,52287748.00,United States,,53023,Miscellaneous,Multi-Sector Companies
REG,Regency Centers Corporation Common Stock,$74.42,0.81,1.10%,13507631570.00,United States,1993,950985,Real Estate,Real Estate Investment Trusts
REGCO,Regency Centers Corporation 5.875% Series B Cumulative Redeemable Preferred Stock,$22.29,0.14,0.632%,4045755277.00,United States,,11048,Real Estate,Real Estate Investment Trusts
REGCP,Regency Centers Corporation 6.25% Series A Cumulative Redeemable Preferred Stock,$23.20,0.16,0.694%,4210925187.00,United States,,20102,Real Estate,Real Estate Investment Trusts
REGN,Regeneron Pharmaceuticals Inc. Common Stock,$665.46,-24.90,-3.607%,72751202884.00,United States,1991,1270766,Health Care,Biotechnology: Pharmaceutical Preparations
REKR,Rekor Systems Inc. Common Stock,$2.03,-0.07,-3.333%,190465408.00,United States,,4847166,Telecommunications,Telecommunications Equipment
RELI,Reliance Global Group Inc. Common Stock,$1.74,-0.11,-5.946%,2979877.00,United States,,59803,Finance,Specialty Insurers
RELL,Richardson Electronics Ltd. Common Stock,$13.29,0.26,1.995%,191490400.00,United States,1983,44217,Technology,Electronic Components
RELY,Remitly Global Inc. Common Stock,$25.22,-0.48,-1.868%,4995102480.00,United States,2021,941382,Consumer Discretionary,Business Services
RENB,Renovaro Inc. Common Stock,$0.7381,-0.0154,-2.044%,117149270.00,United States,,333721,Health Care,Biotechnology: Pharmaceutical Preparations
RENE,Cartesian Growth Corporation II Class A Ordinary Shares,$11.77,0.00,0.00%,0.00,United States,2022,22,Finance,Blank Checks
RENEW,Cartesian Growth Corporation II Warrant,$0.07,-0.005,-6.667%,0.00,United States,2022,1080,Finance,Blank Checks
RENT,Rent the Runway Inc. Class A Common Stock,$7.08,-0.10,-1.393%,27486082.00,United States,2021,13029,Consumer Discretionary,Other Specialty Stores
REPL,Replimune Group Inc. Common Stock,$12.85,-0.27,-2.058%,879164155.00,United States,2018,371662,Health Care,Biotechnology: Biological Products (No Diagnostic Substances)
REVB,Revelation Biosciences Inc. Common Stock,$3.87,-0.326,-7.769%,2021227.00,United States,2020,77897,Health Care,Biotechnology: Pharmaceutical Preparations
REVBW,Revelation Biosciences Inc. Warrant,$0.0184,-0.0004,-2.128%,9610.00,United States,2020,6305,Health Care,Biotechnology: Pharmaceutical Preparations
REYN,Reynolds Consumer Products Inc. Common Stock,$24.67,0.07,0.285%,5184922838.00,United States,2020,716198,Consumer Discretionary,Containers/Packaging
RFIL,RF Industries Ltd. Common Stock,$5.61,0.25,4.664%,59154258.00,United States,,191423,Technology,Electrical Products
RGCO,RGC Resources Inc. Common Stock,$21.40,-0.06,-0.28%,219632287.00,United States,,7907,Utilities,Oil & Gas Production
RGEN,Repligen Corporation Common Stock,$149.49,-4.37,-2.84%,8375435120.00,United States,1986,429688,Health Care,Biotechnology: Biological Products (No Diagnostic Substances)
RGLD,Royal Gold Inc. Common Stock,$144.87,-2.20,-1.496%,9526192686.00,United States,,366945,Industrials,Precious Metals
RGLS,Regulus Therapeutics Inc. Common Stock,$1.13,-0.07,-5.833%,74015151.00,United States,2012,291090,Health Care,Biotechnology: Pharmaceutical Preparations
RGNX,REGENXBIO Inc. Common Stock,$7.33,-0.56,-7.098%,363165370.00,United States,2015,973585,Health Care,Biotechnology: Biological Products (No Diagnostic Substances)
RGP,Resources Connection Inc. Common Stock,$8.33,0.19,2.334%,275648921.00,United States,,222386,Consumer Discretionary,Business Services
RGS,Regis Corporation Common Stock,$26.79,0.89,3.436%,61145362.00,United States,1991,72515,Consumer Discretionary,Other Consumer Services
RGTI,Rigetti Computing Inc. Common Stock,$11.02,-1.33,-10.769%,2119099815.00,United States,,71272014,Technology,EDP Services
RGTIW,Rigetti Computing Inc. Warrants,$4.05,-0.57,-12.338%,778798026.00,United States,,363860,Technology,EDP Services
RICK,RCI Hospitality Holdings Inc. Common Stock,$51.34,-1.97,-3.695%,456926000.00,United States,1995,131584,Consumer Discretionary,Restaurants
RIGL,Rigel Pharmaceuticals Inc. Common Stock,$20.84,-0.62,-2.889%,367097434.00,United States,2000,186609,Health Care,Biotechnology: Pharmaceutical Preparations
RILY,B. Riley Financial Inc. Common Stock,$4.29,-0.06,-1.379%,130844704.00,United States,,461534,Finance,Investment Managers
RILYG,B. Riley Financial Inc. 5.00% Senior Notes due 2026,$11.22,-0.64,-5.396%,342209226.00,United States,,17221,Finance,Investment Managers
RILYK,B. Riley Financial Inc. 5.50% Senior Notes Due 2026,$20.56,-0.19,-0.916%,627078581.00,United States,,36416,Finance,Investment Managers
RILYL,B. Riley Financial Inc. Depositary Shares each representing 1/1000th in a share of 7.375% Series B Cumulative Perpetual Preferred Stock par value $0.0001,$5.37,0.42,8.485%,163784629.00,United States,,37493,Finance,Investment Managers
RILYM,B. Riley Financial Inc. 6.375% Senior Notes due 2025,$25.06,0.06,0.24%,764328271.00,United States,,33227,Finance,Investment Managers
RILYN,B. Riley Financial Inc. 6.50% Senior Notes Due 2026,$12.06,-0.49,-3.904%,367829168.00,United States,,34820,Finance,Investment Managers
RILYP,B. Riley Financial Inc. Depositary Shares each representing a 1/1000th fractional interest in a share of Series A Cumulative Perpetual Preferred Stock,$4.50,-0.30,-6.25%,137249690.00,United States,,29270,Finance,Investment Managers
RILYT,B. Riley Financial Inc. 6.00% Senior Notes Due 2028,$9.55,-0.43,-4.309%,291274341.00,United States,,24695,Finance,Investment Managers
RILYZ,B. Riley Financial Inc. 5.25% Senior Notes due 2028,$8.68,-0.21,-2.362%,264739401.00,United States,,49419,Finance,Investment Managers
RIME,Algorhythm Holdings Inc. Common Stock,$2.87,-0.11,-3.691%,40797555.00,United States,,1081495,Consumer Staples,Diversified Electronic Products
RIOT,Riot Platforms Inc. Common Stock ,$11.14,-0.49,-4.213%,3702106460.00,United States,,20090797,Finance,Finance: Consumer Services
RIVN,Rivian Automotive Inc. Class A Common Stock,$12.44,-0.55,-4.234%,12697140585.00,United States,2021,25086964,Consumer Discretionary,Auto Manufacturing
RKDA,Arcadia Biosciences Inc. Common Stock,$4.7607,-0.0393,-0.819%,6498070.00,United States,2015,4191,Consumer Staples,Farming/Seeds/Milling
RKLB,Rocket Lab USA Inc. Common Stock,$28.22,-2.38,-7.778%,14107490621.00,United States,2020,20175358,Industrials,Military/Government/Technical
RLAY,Relay Therapeutics Inc. Common Stock,$3.74,-0.27,-6.733%,626012263.00,United States,2020,1986118,Health Care,Biotechnology: Biological Products (No Diagnostic Substances)
RLMD,Relmada Therapeutics Inc. Common Stock,$0.2858,-0.0226,-7.328%,8623787.00,United States,,946181,Health Care,Biotechnology: Pharmaceutical Preparations
RLYB,Rallybio Corporation Common Stock,$0.746,-0.034,-4.359%,30949739.00,United States,2021,97271,Health Care,Biotechnology: Pharmaceutical Preparations
RMBI,Richmond Mutual Bancorporation Inc. Common Stock,$13.99,-0.12,-0.85%,152611174.00,United States,2019,9512,Finance,Major Banks
RMBL,RumbleOn Inc. Class B Common Stock,$4.33,-0.10,-2.257%,153156231.00,United States,,82698,Technology,EDP Services
RMBS,Rambus Inc. Common Stock,$64.72,-2.45,-3.647%,6897562283.00,United States,1997,968809,Technology,Semiconductors
RMCF,Rocky Mountain Chocolate Factory Inc. Common Stock,$1.88,0.035,1.897%,14452128.00,United States,,21673,Consumer Staples,Specialty Foods
RMCO,Royalty Management Holding Corporation Class A Common Stock,$1.17,0.00,0.00%,17471514.00,United States,2023,2416,Miscellaneous,Multi-Sector Companies
RMCOW,Royalty Management Holding Corporation Warrant,$0.0156,-0.0021,-11.864%,232954.00,United States,2023,6225,Miscellaneous,Multi-Sector Companies
RMNI,Rimini Street Inc. (DE) Common Stock,$2.87,0.06,2.135%,260940400.00,United States,2015,138873,Consumer Discretionary,Business Services
RMR,The RMR Group Inc. Class A Common Stock,$18.71,0.16,0.863%,595814112.00,United States,,150907,Consumer Discretionary,Professional Services
RMSG,Real Messenger Corporation Ordinary Shares,$1.73,-0.06,-3.352%,16125846.00,United States,,5749,Technology,Computer Software: Programming Data Processing
RMSGW,Real Messenger Corporation Warrants,$0.0408,0.001,2.513%,380309.00,United States,,7372,Technology,Computer Software: Programming Data Processing
RMTI,Rockwell Medical Inc. Common Stock,$1.79,-0.08,-4.278%,57850663.00,United States,1998,469062,Health Care,Biotechnology: Pharmaceutical Preparations
RNA,Avidity Biosciences Inc. Common Stock,$33.79,-0.52,-1.516%,4031461821.00,United States,2020,1506165,Health Care,Biotechnology: Pharmaceutical Preparations
RNAC,Cartesian Therapeutics Inc. Common Stock,$18.52,0.01,0.054%,470683911.00,United States,2016,47137,Health Care,Biotechnology: Pharmaceutical Preparations
RNAZ,TransCode Therapeutics Inc. Common Stock,$10.83,-0.97,-8.22%,7540203.00,United States,2021,288056,Health Care,Biotechnology: Pharmaceutical Preparations
RNTX,Rein Therapeutics Inc. Common Stock,$2.13,-0.12,-5.333%,46148454.00,United States,2017,32196,Health Care,Biotechnology: Pharmaceutical Preparations
RNXT,RenovoRx Inc. Common Stock,$1.15,0.00,0.00%,27601540.00,United States,2021,129264,Health Care,Biotechnology: Pharmaceutical Preparations
ROAD,Construction Partners Inc. Class A Common Stock,$81.21,-0.41,-0.502%,3831780075.00,United States,2018,571162,Industrials,Military/Government/Technical
ROCK,Gibraltar Industries Inc. Common Stock,$60.37,0.24,0.399%,1831693475.00,United States,1993,101120,Industrials,Steel/Iron Ore
ROIC,Retail Opportunity Investments Corp. Common Stock (MD),$17.49,-0.01,-0.057%,2250068736.00,United States,,840126,Real Estate,Real Estate Investment Trusts
ROKU,Roku Inc. Class A Common Stock,$82.75,-1.85,-2.187%,12015236034.00,United States,2017,3596339,Telecommunications,Cable & Other Pay Television Services
ROOT,Root Inc. Class A Common Stock,$114.52,-1.62,-1.395%,1729252000.00,United States,2020,393969,Finance,Property-Casualty Insurers
ROP,Roper Technologies Inc. Common Stock,$581.35,6.83,1.189%,62337666934.00,United States,1992,552398,Industrials,Industrial Machinery/Components
ROST,Ross Stores Inc. Common Stock,$141.27,-0.86,-0.605%,46609097660.00,United States,1985,2704129,Consumer Discretionary,Clothing/Shoe/Accessory Stores
RPAY,Repay Holdings Corporation Class A Common Stock,$7.25,-0.42,-5.476%,666307980.00,United States,2018,620799,Consumer Discretionary,Business Services
RPD,Rapid7 Inc. Common Stock,$37.93,-0.37,-0.966%,2397426414.00,United States,2015,534997,Technology,Computer Software: Prepackaged Software
RPID,Rapid Micro Biosystems Inc. Class A Common Stock,$2.68,-0.14,-4.965%,115331712.00,United States,2021,267565,Industrials,Biotechnology: Laboratory Analytical Instruments
RPRX,Royalty Pharma plc Class A Ordinary Shares ,$32.25,0.53,1.671%,19001144752.00,United States,2020,7664922,Health Care,Biotechnology: Pharmaceutical Preparations
RR,Richtech Robotics Inc. Class B Common Stock,$2.71,-0.30,-9.967%,303661581.00,United States,2023,13734759,Industrials,Industrial Machinery/Components
RRBI,Red River Bancshares Inc. Common Stock,$58.01,-0.57,-0.973%,395983221.00,United States,2019,11216,Consumer Discretionary,Hotels/Resorts
RRGB,Red Robin Gourmet Burgers Inc. Common Stock,$5.13,0.08,1.584%,80935810.00,United States,2002,230184,Consumer Discretionary,Restaurants
RRR,Red Rock Resorts Inc. Class A Common Stock,$50.92,0.51,1.012%,5378121364.00,United States,2016,1092375,Consumer Discretionary,Hotels/Resorts
RSLS,ReShape Lifesciences Inc. Common Stock,$2.705,-0.1057,-3.761%,1927799.00,United States,2016,11474,Health Care,Medical/Dental Instruments
RSSS,Research Solutions Inc Common Stock,$3.90,0.05,1.299%,126801371.00,United States,,64344,Consumer Discretionary,Business Services
RSVR,Reservoir Media Inc. Common Stock,$8.09,-0.04,-0.492%,527731386.00,United States,2021,34747,Consumer Discretionary,Services-Misc. Amusement & Recreation
RUM,Rumble Inc. Class A Common Stock,$11.17,-1.08,-8.816%,4350916764.00,United States,2021,3347706,Technology,Computer Software: Programming Data Processing
RUMBW,Rumble Inc. Warrant,$4.33,-0.32,-6.882%,1686613213.00,United States,2021,39098,Technology,Computer Software: Programming Data Processing
RUN,Sunrun Inc. Common Stock,$8.10,-0.26,-3.11%,1817148929.00,United States,2015,8420778,Miscellaneous,Industrial Machinery/Components
RUSHA,Rush Enterprises Inc. Common Stock Cl A,$59.66,-0.01,-0.017%,4714717172.00,United States,,296775,Consumer Discretionary,Retail-Auto Dealers and Gas Stations
RUSHB,Rush Enterprises Inc. Class B,$57.23,1.04,1.851%,4522682932.00,United States,,13767,Consumer Discretionary,Retail-Auto Dealers and Gas Stations
RVMD,Revolution Medicines Inc. Common Stock,$41.45,-0.61,-1.45%,6972693757.00,United States,2020,1042737,Health Care,Biotechnology: Biological Products (No Diagnostic Substances)
RVMDW,Revolution Medicines Inc. Warrant,$0.145,0.00,0.00%,24391812.00,United States,,6,,
RVPH,Reviva Pharmaceuticals Holdings Inc. Common Stock ,$1.91,-0.15,-7.282%,63872690.00,United States,2020,1530622,Health Care,Biotechnology: Pharmaceutical Preparations
RVPHW,Reviva Pharmaceuticals Holdings Inc. Warrants,$0.1475,-0.0159,-9.731%,4932577.00,United States,2018,27471,Health Care,Biotechnology: Pharmaceutical Preparations
RVSB,Riverview Bancorp Inc Common Stock,$5.45,-0.03,-0.547%,114823886.00,United States,,73538,Finance,Savings Institutions
RVYL,Ryvyl Inc. Common Stock,$1.18,-0.025,-2.075%,8726310.00,United States,,67980,Consumer Discretionary,Professional Services
RWAY,Runway Growth Finance Corp. Common Stock,$11.43,-0.04,-0.349%,427477679.00,United States,2021,307812,Finance,Finance: Consumer Services
RWAYL,Runway Growth Finance Corp. 7.50% Notes due 2027,$25.2199,0.0247,0.098%,943214727.00,United States,,3153,Finance,Finance: Consumer Services
RWAYZ,Runway Growth Finance Corp. 8.00% Notes due 2027,$25.4299,0.0299,0.118%,951068647.00,United States,,3986,Finance,Finance: Consumer Services
RXRX,Recursion Pharmaceuticals Inc. Class A Common Stock,$7.66,0.01,0.131%,2195668781.00,United States,2021,23845871,Health Care,Biotechnology: Biological Products (No Diagnostic Substances)
RXST,RxSight Inc. Common Stock,$32.19,0.13,0.405%,1297400728.00,United States,2021,417883,Health Care,Ophthalmic Goods
RXT,Rackspace Technology Inc. Common Stock,$2.89,-0.06,-2.034%,657674078.00,United States,2020,556309,Technology,Computer Software: Programming Data Processing
RYTM,Rhythm Pharmaceuticals Inc. Common Stock,$57.58,-0.89,-1.522%,3538698033.00,United States,2017,289541,Health Care,Biotechnology: Pharmaceutical Preparations
RZLT,Rezolute Inc. Common Stock (NV),$4.78,-0.06,-1.24%,276967855.00,United States,,286555,Health Care,Biotechnology: Pharmaceutical Preparations
SABR,Sabre Corporation Common Stock,$3.42,-0.04,-1.156%,1319620636.00,United States,2014,2465814,Technology,Computer Software: Programming Data Processing
SABS,SAB Biotherapeutics Inc. Common Stock,$1.65,-0.03,-1.786%,15228302.00,United States,2021,117212,Health Care,Biotechnology: Biological Products (No Diagnostic Substances)
SABSW,SAB Biotherapeutics Inc. Warrant,$0.03,-0.0003,-0.99%,276878.00,United States,2021,5872,Health Care,Biotechnology: Biological Products (No Diagnostic Substances)
SAFT,Safety Insurance Group Inc. Common Stock,$78.72,0.98,1.261%,1168047911.00,United States,2002,28689,Finance,Property-Casualty Insurers
SAGE,Sage Therapeutics Inc. Common Stock,$7.19,-0.07,-0.964%,439835761.00,United States,2014,2071229,Health Care,Biotechnology: Pharmaceutical Preparations
SAIA,Saia Inc. Common Stock,$492.55,-3.44,-0.694%,13099404191.00,United States,,211764,Industrials,Trucking Freight/Courier Services
SAIC,Science Applications International Corporation Common Stock,$105.10,-0.54,-0.511%,5137447332.00,United States,,740587,Technology,EDP Services
SAMG,Silvercrest Asset Management Group Inc. Class A Common Stock,$18.63,0.21,1.14%,258299454.00,United States,2013,31264,Finance,Investment Managers
SANA,Sana Biotechnology Inc. Common Stock,$2.755,0.02,0.731%,615105789.00,United States,2021,2269771,Health Care,Biotechnology: Biological Products (No Diagnostic Substances)
SANM,Sanmina Corporation Common Stock,$88.96,-0.14,-0.157%,4832780378.00,United States,1993,492496,Technology,Electrical Products
SANW,S&W Seed Company Common Stock (NV),$8.81,-0.1782,-1.983%,20126181.00,United States,,6096,Consumer Staples,Farming/Seeds/Milling
SASR,Sandy Spring Bancorp Inc. Common Stock,$34.82,0.53,1.546%,1571624865.00,United States,,180568,Finance,Major Banks
SATS,EchoStar  Corporation Common Stock,$28.68,-0.37,-1.274%,7796395635.00,United States,,1614459,Consumer Discretionary,Telecommunications Equipment
SAVA,Cassava Sciences Inc. Common Stock,$2.31,-0.01,-0.431%,111135197.00,United States,,1019719,Health Care,Biotechnology: Pharmaceutical Preparations
SBAC,SBA Communications Corporation Class A Common Stock,$209.24,2.93,1.42%,22498032172.00,United States,1999,526293,Real Estate,Real Estate Investment Trusts
SBC,SBC Medical Group Holdings Incorporated Common Stock,$5.04,-0.09,-1.754%,519224913.00,United States,2022,9896,Health Care,Medical/Nursing Services
SBCF,Seacoast Banking Corporation of Florida Common Stock,$30.02,0.83,2.843%,2564938850.00,United States,,470853,Finance,Major Banks
SBFG,SB Financial Group Inc. Common Stock,$23.93,-0.07,-0.292%,159180565.00,United States,,11518,Finance,Major Banks
SBGI,Sinclair Inc. Class A Common Stock,$14.77,0.06,0.408%,981032262.00,United States,1995,120654,Industrials,Broadcasting
