Symbol,Name,Last Sale,Net Change,% Change,Market Cap,Country,IPO Year,Volume,Sector,Industry
AADI,Aadi Bioscience Inc. Common Stock,$2.70,0.04,1.504%,66547958.00,United States,,133248,Health Care,Biotechnology: Pharmaceutical Preparations
AAL,American Airlines Group Inc. Common Stock,$16.41,-0.21,-1.264%,10783519644.00,United States,,28986604,Consumer Discretionary,Air Freight/Delivery Services
AAME,Atlantic American Corporation Common Stock,$1.61,0.0042,0.262%,32843610.00,United States,,4950,Finance,Life Insurance
AAOI,Applied Optoelectronics Inc. Common Stock,$27.85,-2.67,-8.748%,1255427954.00,United States,2013,2688302,Technology,Semiconductors
AAON,AAON Inc. Common Stock,$112.76,-0.51,-0.45%,9165090515.00,United States,,475608,Industrials,Industrial Machinery/Components
AAPL,Apple Inc. Common Stock,$232.62,4.97,2.183%,3494434621260.00,United States,1980,53677039,Technology,Computer Manufacturing
ABAT,American Battery Technology Company Common Stock,$1.22,-0.06,-4.688%,90916436.00,United States,,2354974,Basic Materials,Metal Mining
ABEO,Abeona Therapeutics Inc. Common Stock,$5.65,-0.17,-2.921%,245611320.00,United States,,182498,Health Care,Biotechnology: Pharmaceutical Preparations
ABL,Abacus Life Inc. Class A Common Stock,$7.60,-0.02,-0.262%,567558644.00,United States,2020,293798,Finance,Investment Managers
ABLLL,Abacus Life Inc. 9.875% Fixed Rate Senior Notes due 2028,$27.275,0.055,0.202%,2036115489.00,United States,,567,Finance,Investment Managers
ABLLW,Abacus Life Inc. Warrant,$1.08,0.02,1.887%,80653071.00,United States,2020,20441,Finance,Investment Managers
ABNB,Airbnb Inc. Class A Common Stock,$134.52,-0.72,-0.532%,85281865013.00,United States,2020,4041294,Finance,Diversified Commercial Services
ABOS,Acumen Pharmaceuticals Inc. Common Stock,$1.33,-0.06,-4.317%,79906105.00,United States,2021,413093,Health Care,Biotechnology: Biological Products (No Diagnostic Substances)
ABP,Abpro Holdings Inc Common Stock,$0.99,0.01,1.02%,51003419.00,United States,2022,56579,Health Care,Biotechnology: Pharmaceutical Preparations
ABPWW,Abpro Holdings Inc. Warrant,$0.049,0.0026,5.603%,2524412.00,United States,2022,41022,Health Care,Biotechnology: Pharmaceutical Preparations
ABSI,Absci Corporation Common Stock,$4.91,0.58,13.395%,563941777.00,United States,2021,5990366,Health Care,Biotechnology: Commercial Physical & Biological Resarch
ABVC,ABVC BioPharma Inc. Common Stock,$0.421,0.0009,0.214%,5462682.00,United States,,49815,Health Care,Biotechnology: Pharmaceutical Preparations
ACAD,ACADIA Pharmaceuticals Inc. Common Stock,$18.49,-0.39,-2.066%,3076586065.00,United States,1985,1455269,Health Care,Biotechnology: Pharmaceutical Preparations
ACCD,Accolade Inc. Common Stock,$6.87,-0.02,-0.29%,560492440.00,United States,2020,2472698,Consumer Discretionary,Business Services
ACDC,ProFrac Holding Corp. Class A Common Stock,$7.93,0.06,0.762%,1269962554.00,United States,2022,309771,Energy,Oilfield Services/Equipment
ACET,Adicet Bio Inc. Common Stock ,$0.901,0.001,0.111%,74243265.00,United States,2018,629630,Health Care,Biotechnology: Pharmaceutical Preparations
ACHC,Acadia Healthcare Company Inc. Common Stock,$41.98,-0.87,-2.03%,3899327077.00,United States,,905533,Health Care,Medical Specialities
ACHV,Achieve Life Sciences Inc. Common Shares,$3.37,-0.16,-4.533%,115894118.00,United States,,474723,Health Care,Biotechnology: In Vitro & In Vivo Diagnostic Substances
ACIC,American Coastal Insurance Corporation Common Stock,$11.88,0.01,0.084%,572674949.00,United States,,119681,Finance,Property-Casualty Insurers
ACIW,ACI Worldwide Inc. Common Stock,$52.31,-0.66,-1.246%,5486724863.00,United States,,502543,Technology,Computer Software: Prepackaged Software
ACLS,Axcelis Technologies Inc. Common Stock,$59.30,-8.28,-12.252%,1927612382.00,United States,2000,2270439,Technology,Industrial Machinery/Components
ACLX,Arcellx Inc. Common Stock,$63.16,-3.84,-5.731%,3415356157.00,United States,2022,769533,Health Care,Biotechnology: Biological Products (No Diagnostic Substances)
ACMR,ACM Research Inc. Class A Common Stock,$23.05,-0.31,-1.327%,1443571873.00,United States,2017,986990,Technology,Industrial Machinery/Components
ACNB,ACNB Corporation Common Stock,$41.59,0.69,1.687%,355537314.00,United States,,34554,Finance,Major Banks
ACNT,Ascent Industries Co. Common Stock,$11.16,-0.10,-0.888%,112637501.00,United States,,9295,Industrials,Steel/Iron Ore
ACON,Aclarion Inc. Common Stock,$4.19,-0.48,-10.278%,552829.00,United States,2022,2092428,Health Care,Medical Specialities
ACONW,Aclarion Inc. Warrant,$0.0581,-0.0209,-26.456%,7666.00,United States,2022,31131,Health Care,Medical Specialities
ACRS,Aclaris Therapeutics Inc. Common Stock,$2.20,-0.19,-7.95%,157148072.00,United States,2015,412654,Health Care,Biotechnology: Pharmaceutical Preparations
ACRV,Acrivon Therapeutics Inc. Common Stock,$4.91,-0.71,-12.633%,152879213.00,United States,2022,79290,Health Care,Biotechnology: Pharmaceutical Preparations
ACT,Enact Holdings Inc. Common Stock,$33.79,-0.16,-0.471%,5189781231.00,United States,2021,172729,Finance,Specialty Insurers
ACTG,Acacia Research Corporation (Acacia Tech) Common Stock,$4.25,0.00,0.00%,413814701.00,United States,,67398,Miscellaneous,Multi-Sector Companies
ACTU,Actuate Therapeutics Inc. Common stock,$8.04,-0.71,-8.114%,157034353.00,United States,2024,26644,Health Care,Biotechnology: Pharmaceutical Preparations
ACVA,ACV Auctions Inc. Class A Common Stock,$21.42,-0.18,-0.833%,3590848007.00,United States,2021,1370445,Consumer Discretionary,Business Services
ACXP,Acurx Pharmaceuticals Inc. Common Stock,$0.742,-0.0168,-2.214%,12534271.00,United States,2021,55839,Health Care,Biotechnology: Pharmaceutical Preparations
ADBE,Adobe Inc. Common Stock,$458.82,7.72,1.711%,199724346000.00,United States,1986,3255500,Technology,Computer Software: Prepackaged Software
ADD,Color Star Technology Co. Ltd. Class A Ordinary Shares,$1.27,-0.18,-12.414%,780589.00,United States,,753450,Consumer Discretionary,Engineering & Construction
ADEA,Adeia Inc. Common Stock,$13.215,0.205,1.576%,1443936142.00,United States,2003,319627,Technology,Computer Software: Prepackaged Software
ADGM,Adagio Medical Holdings Inc Common Stock,$1.13,0.09,8.654%,16424704.00,United States,,97334,Health Care,Medical/Dental Instruments
ADI,Analog Devices Inc. Common Stock,$203.46,-1.40,-0.683%,100976557915.00,United States,,2335742,Technology,Semiconductors
ADIL,Adial Pharmaceuticals Inc Common Stock,$0.7784,-0.0001,-0.013%,4986260.00,United States,2018,46971,Health Care,Biotechnology: Pharmaceutical Preparations
ADMA,ADMA Biologics Inc Common Stock,$15.88,-0.78,-4.682%,3753877218.00,United States,,1775958,Health Care,Biotechnology: Biological Products (No Diagnostic Substances)
ADN,Advent Technologies Holdings Inc. Class A Common Stock,$4.93,0.04,0.818%,12997984.00,United States,2018,14126,Miscellaneous,Industrial Machinery/Components
ADNWW,Advent Technologies Holdings Inc. Warrant,$0.013,0.0001,0.775%,34275.00,United States,2018,142731,Miscellaneous,Industrial Machinery/Components
ADP,Automatic Data Processing Inc. Common Stock,$305.78,-1.15,-0.375%,124412981662.00,United States,,1150971,Technology,EDP Services
ADPT,Adaptive Biotechnologies Corporation Common Stock,$7.80,0.12,1.563%,1151119991.00,United States,2019,1778458,Health Care,Biotechnology: Biological Products (No Diagnostic Substances)
ADSK,Autodesk Inc. Common Stock,$299.72,-5.27,-1.728%,64439800000.00,United States,,1375462,Technology,Computer Software: Prepackaged Software
ADTN,ADTRAN Holdings Inc. Common Stock,$11.07,-0.28,-2.467%,877285788.00,United States,1994,595084,Utilities,Telecommunications Equipment
ADTX,Aditxt Inc. Common Stock,$0.0952,-0.0094,-8.987%,1355097.00,United States,2020,176172642,Health Care,Biotechnology: Pharmaceutical Preparations
ADUS,Addus HomeCare Corporation Common Stock,$114.67,-1.79,-1.537%,2079324297.00,United States,2009,181347,Health Care,Medical/Nursing Services
ADV,Advantage Solutions Inc. Class A Common Stock,$2.76,0.10,3.759%,885280347.00,United States,2019,331461,Consumer Discretionary,Business Services
ADVM,Adverum Biotechnologies Inc. Common Stock,$4.03,-0.41,-9.234%,83833926.00,United States,2014,401155,Health Care,Biotechnology: Biological Products (No Diagnostic Substances)
ADVWW,Advantage Solutions Inc. Warrant,$0.0148,0.00,0.00%,4747155.00,United States,2019,6902,Consumer Discretionary,Business Services
AEHR,Aehr Test Systems Common Stock,$10.29,-0.41,-3.832%,305734463.00,United States,1997,699887,Industrials,Electrical Products
AEI,Alset Inc. Common Stock (TX),$0.97,0.0195,2.052%,8958065.00,United States,2020,263843,Finance,Real Estate
AEIS,Advanced Energy Industries Inc. Common Stock,$111.36,-1.47,-1.303%,4195272741.00,United States,1995,231065,Technology,Industrial Machinery/Components
AEMD,Aethlon Medical Inc. Common Stock,$0.6818,0.0023,0.338%,9519290.00,United States,,408181,Health Care,Medical/Dental Instruments
AENT,Alliance Entertainment Holding Corporation Class A Common Stock,$4.88,-0.41,-7.75%,248671966.00,United States,,77533,Consumer Discretionary,Durable Goods
AENTW,Alliance Entertainment Holding Corporation Warrants,$0.2725,-0.045,-14.173%,13885883.00,United States,,22102,Consumer Discretionary,Durable Goods
AEP,American Electric Power Company Inc. Common Stock,$101.88,1.05,1.041%,54257756330.00,United States,,3165875,Utilities,Electric Utilities: Central
AERT,Aeries Technology Inc. Class A Ordinary Share,$0.56,-0.0069,-1.217%,24920239.00,United States,2021,88368,Consumer Discretionary,Professional Services
AERTW,Aeries Technology Inc. Warrant,$0.04,0.00,0.00%,1780017.00,United States,2021,13,Consumer Discretionary,Professional Services
AEVA,Aeva Technologies Inc. Common Stock,$4.12,0.02,0.488%,221997140.00,United States,,727536,Consumer Discretionary,Auto Parts:O.E.M.
AEVAW,Aeva Technologies Inc. Warrants,$0.08,0.005,6.667%,4310624.00,United States,,17466,Consumer Discretionary,Auto Parts:O.E.M.
AEYE,AudioEye Inc. Common Stock,$18.41,-0.24,-1.287%,224199373.00,United States,,133493,Technology,Computer Software: Prepackaged Software
AFBI,Affinity Bancshares Inc. Common Stock (MD),$18.41,0.26,1.433%,118052836.00,United States,2017,43870,Finance,Banks
AFCG,Advanced Flower Capital Inc. Common Stock,$8.63,0.08,0.936%,189451603.00,United States,2021,87062,Finance,Real Estate
AFJK,Aimei Health Technology Co. Ltd Ordinary Share,$10.86,0.04,0.37%,0.00,United States,2024,153189,,
AFJKR,Aimei Health Technology Co. Ltd Right,$0.24,0.01,4.348%,0.00,United States,2024,1600,,
AFJKU,Aimei Health Technology Co. Ltd Unit,$11.30,0.29,2.634%,0.00,United States,2023,100,,
AFRM,Affirm Holdings Inc. Class A Common Stock,$78.02,0.27,0.347%,24814764229.00,United States,2021,8486167,Finance,Finance: Consumer Services
AGAE,Allied Gaming & Entertainment Inc. Common Stock,$0.95,-0.0501,-5.009%,41900713.00,United States,2017,13300,Consumer Discretionary,Services-Misc. Amusement & Recreation
AGEN,Agenus Inc. Common Stock,$3.21,-0.02,-0.619%,75303162.00,United States,2000,370628,Health Care,Biotechnology: Biological Products (No Diagnostic Substances)
AGFY,Agrify Corporation Common Stock,$21.56,0.81,3.904%,32981345.00,United States,2021,15883,Consumer Staples,Farming/Seeds/Milling
AGIO,Agios Pharmaceuticals Inc. Common Stock,$32.66,-1.31,-3.856%,1862606169.00,United States,2013,602045,Health Care,Biotechnology: Pharmaceutical Preparations
AGNC,AGNC Investment Corp. Common Stock,$10.18,0.04,0.394%,9015813500.00,United States,2008,20213948,Real Estate,Real Estate Investment Trusts
AGNCL,AGNC Investment Corp. Depositary Shares Each Representing a 1/1000th Interest in a Share of 7.75% Series G Fixed-Rate Reset Cumulative Redeemable Preferred Stock,$24.80,0.17,0.69%,21963867858.00,United States,,17902,Real Estate,Real Estate Investment Trusts
AGNCM,AGNC Investment Corp. Depositary Shares rep 6.875% Series D Fixed-to-Floating Cumulative Redeemable Preferred Stock,$25.1586,0.0286,0.114%,22281458303.00,United States,,10693,Real Estate,Real Estate Investment Trusts
AGNCN,AGNC Investment Corp. Depositary Shares Each Representing a 1/1000th Interest in a Share of 7.00% Series C Fixed-To-Floating Rate Cumulative Redeemable Preferred Stock,$25.69,-0.01,-0.039%,22752087310.00,United States,,15541,Real Estate,Real Estate Investment Trusts
AGNCO,AGNC Investment Corp. Depositary Shares each representing a 1/1000th interest in a share of 6.50% Series E Fixed-to-Floating Cumulative Redeemable Preferred Stock,$25.38,0.01,0.039%,22477538962.00,United States,,14863,Real Estate,Real Estate Investment Trusts
AGNCP,AGNC Investment Corp. Depositary Shares Each Representing a 1/1000th Interest in a Share of 6.125% Series F Fixed-to-Floating Rate Cumulative Redeemable Preferred Stock,$24.97,0.02,0.08%,22114426630.00,United States,,24705,Real Estate,Real Estate Investment Trusts
AGYS,Agilysys Inc. Common Stock (DE),$83.97,-1.59,-1.858%,2348136072.00,United States,,311163,Technology,EDP Services
AHCO,AdaptHealth Corp. Common Stock,$9.19,0.035,0.382%,1236559430.00,United States,2018,1240574,Health Care,Medical/Nursing Services
AIEV,Thunder Power Holdings Inc. Common Stock,$0.244,-0.002,-0.813%,12376818.00,United States,2022,46405,Consumer Discretionary,Auto Manufacturing
AIFF,Firefly Neuroscience Inc. Common Stock,$8.40,5.30,170.968%,71428266.00,United States,,194509089,Technology,Computer Software: Prepackaged Software
AIMAU,Aimfinity Investment Corp. I Unit,$12.11,0.0001,0.001%,0.00,United States,2022,135,Finance,Blank Checks
AIMAW,Aimfinity Investment Corp. I Warrant,$0.0255,0.0055,27.50%,0.00,United States,2022,100,Finance,Blank Checks
AIMBU,Aimfinity Investment Corp. I Subunit,$12.01,0.02,0.167%,0.00,United States,2022,870,Finance,Blank Checks
AIMD,Ainos Inc. Common Stock,$0.60,0.0075,1.266%,8303296.00,United States,,41763,Health Care,Biotechnology: Pharmaceutical Preparations
AIMDW,Ainos Inc. Warrants,$0.10,-0.0545,-35.275%,1383883.00,United States,,21890,Health Care,Biotechnology: Pharmaceutical Preparations
AIOT,PowerFleet Inc. Common Stock,$8.51,0.71,9.103%,1124499120.00,United States,,6909231,Telecommunications,Telecommunications Equipment
AIP,Arteris Inc. Common Stock,$9.51,-0.41,-4.133%,382087007.00,United States,2021,113629,Technology,Semiconductors
AIRE,reAlpha Tech Corp. Common Stock,$1.75,0.04,2.339%,80262880.00,United States,,165392,Finance,Real Estate
AIRG,Airgain Inc. Common Stock,$7.09,-0.02,-0.281%,80433491.00,United States,2016,27049,Technology,Radio And Television Broadcasting And Communications Equipment
AIRJ,AirJoule Technologies Corporation Class A Common Stock,$8.29,-0.54,-6.116%,462939838.00,United States,2022,22158,Industrials,Industrial Machinery/Components
AIRJW,AirJoule Technologies Corporation Warrant,$1.3489,-0.0111,-0.816%,75326845.00,United States,2022,25716,Industrials,Industrial Machinery/Components
AIRS,AirSculpt Technologies Inc. Common Stock,$5.40,-0.05,-0.917%,312564334.00,United States,2021,143288,Health Care,Medical/Nursing Services
AIRT,Air T Inc. Common Stock,$20.05,0.44,2.244%,55338942.00,United States,,7662,Consumer Discretionary,Air Freight/Delivery Services
AIRTP,Air T Inc. Air T Funding Alpha Income Trust Preferred Securities,$17.3984,-0.1016,-0.581%,48020402.00,United States,,3549,Consumer Discretionary,Air Freight/Delivery Services
AISP,Airship AI Holdings Inc. Class A Common Stock,$5.44,-0.30,-5.226%,148427762.00,United States,2021,2173106,Technology,Computer Software: Prepackaged Software
AISPW,Airship AI Holdings Inc. Warrants,$1.8505,-0.1495,-7.475%,50489995.00,United States,2021,146852,Technology,Computer Software: Prepackaged Software
AITR,AI TRANSPORTATION ACQUISITION CORP Ordinary shares,$10.82,0.00,0.00%,0.00,United States,2024,38,,
AITRR,AI TRANSPORTATION ACQUISITION CORP Right,$0.12,-0.015,-11.111%,0.00,United States,2024,286,,
AITRU,AI TRANSPORTATION ACQUISITION CORP Unit,$11.20,0.00,0.00%,0.00,United States,2023,52,,
AKAM,Akamai Technologies Inc. Common Stock,$101.38,-0.72,-0.705%,15230011841.00,United States,1999,1618966,Consumer Discretionary,Business Services
AKBA,Akebia Therapeutics Inc. Common Stock,$2.10,0.00,0.00%,458180524.00,United States,2014,1422793,Health Care,Biotechnology: Pharmaceutical Preparations
AKRO,Akero Therapeutics Inc. Common Stock,$49.95,-1.20,-2.346%,3486467443.00,United States,2019,1594471,Health Care,Biotechnology: Pharmaceutical Preparations
AKYA,Akoya BioSciences Inc. Common Stock,$2.29,-0.05,-2.137%,113500154.00,United States,2021,441865,Industrials,Biotechnology: Laboratory Analytical Instruments
ALAB,Astera Labs Inc. Common Stock,$92.04,-11.25,-10.892%,14598542910.00,United States,2024,14105399,Technology,Semiconductors
ALBT,Avalon GloboCare Corp. Common Stock,$3.56,0.0266,0.753%,3895427.00,United States,,12214,Health Care,Biotechnology: Biological Products (No Diagnostic Substances)
ALCE,Alternus Clean Energy Inc. Class A Common Stock,$0.226,-0.0588,-20.646%,0.00,United States,2022,1508724,Utilities,Power Generation
ALCO,Alico Inc. Common Stock,$30.57,0.80,2.687%,233342919.00,United States,,50396,,
ALCY,Alchemy Investments Acquisition Corp 1 Class A Ordinary Shares,$11.16,0.00,0.00%,0.00,United States,2023,21,Finance,Blank Checks
ALCYW,Alchemy Investments Acquisition Corp 1 Warrants,$0.095,0.0049,5.438%,0.00,United States,2023,1324,Finance,Blank Checks
ALDF,Aldel Financial II Inc. Class A Ordinary Shares,$10.00,-0.01,-0.10%,0.00,United States,2024,25282,,
ALDFU,Aldel Financial II Inc. Units,$10.1152,0.0026,0.026%,0.00,United States,2024,310,Finance,Blank Checks
ALDFW,Aldel Financial II Inc. Warrants,$0.25,-0.01,-3.846%,0.00,United States,2024,1230,,
ALDX,Aldeyra Therapeutics Inc. Common Stock,$5.935,-0.055,-0.918%,353426864.00,United States,2014,339351,Health Care,Biotechnology: Pharmaceutical Preparations
ALEC,Alector Inc. Common Stock,$1.61,-0.04,-2.424%,157671494.00,United States,2019,519373,Health Care,Biotechnology: Biological Products (No Diagnostic Substances)
ALF,Centurion Acquisition Corp. Class A Ordinary Shares,$10.18,0.00,0.00%,0.00,United States,2024,4634,,
ALFUU,Centurion Acquisition Corp. Unit,$10.26,0.02,0.195%,0.00,United States,2024,721,,
ALFUW,Centurion Acquisition Corp. Warrant,$0.15,0.00,0.00%,0.00,United States,2024,1959,Finance,Blank Checks
ALGM,Allegro MicroSystems Inc. Common Stock,$24.49,1.12,4.792%,4509222034.00,United States,2020,2009441,Technology,Semiconductors
ALGN,Align Technology Inc. Common Stock,$210.52,-1.51,-0.712%,15715962191.00,United States,2001,650671,Health Care,Industrial Specialties
ALGS,Aligos Therapeutics Inc. Common Stock,$26.02,-1.68,-6.065%,93356950.00,United States,2020,150402,Health Care,Biotechnology: Biological Products (No Diagnostic Substances)
ALGT,Allegiant Travel Company Common Stock,$85.64,-2.71,-3.067%,1570975535.00,United States,2006,481368,Consumer Discretionary,Air Freight/Delivery Services
ALHC,Alignment Healthcare Inc. Common Stock,$14.38,-0.05,-0.347%,2756589817.00,United States,2021,1530241,Health Care,Medical Specialities
ALKT,Alkami Technology Inc. Common Stock,$33.74,-1.54,-4.365%,3390757106.00,United States,2021,433468,Technology,Computer Software: Prepackaged Software
ALLK,Allakos Inc. Common Stock,$0.2712,-0.0019,-0.696%,24229994.00,United States,2018,869405,Health Care,Biotechnology: Pharmaceutical Preparations
ALLO,Allogene Therapeutics Inc. Common Stock,$1.40,-0.08,-5.405%,293540927.00,United States,2018,3750866,Health Care,Biotechnology: Biological Products (No Diagnostic Substances)
ALLR,Allarity Therapeutics Inc. Common Stock,$1.01,-0.04,-3.81%,4477923.00,United States,,1489082,Health Care,Biotechnology: Pharmaceutical Preparations
ALMS,Alumis Inc. Common Stock,$5.01,0.19,3.942%,272580708.00,United States,2024,390297,Health Care,Biotechnology: Pharmaceutical Preparations
ALNT,Allient Inc. Common Stock,$26.75,2.17,8.828%,450613862.00,United States,,131726,Industrials,Electrical Products
ALNY,Alnylam Pharmaceuticals Inc. Common Stock,$268.99,-5.07,-1.85%,34694576864.00,United States,2004,283048,Health Care,Biotechnology: Pharmaceutical Preparations
ALOT,AstroNova Inc. Common Stock,$11.81,0.01,0.085%,88915577.00,United States,1983,2598,Technology,Computer peripheral equipment
ALRM,Alarm.com Holdings Inc. Common Stock,$63.56,1.06,1.696%,3141713151.00,United States,2015,433693,Technology,Computer Software: Prepackaged Software
ALRS,Alerus Financial Corporation Common Stock,$21.92,0.36,1.67%,555415098.00,United States,2019,48170,Finance,Major Banks
ALT,Altimmune Inc. Common Stock,$6.29,-0.32,-4.841%,447373891.00,United States,,2578578,Health Care,Biotechnology: Pharmaceutical Preparations
ALTI,AlTi Global Inc. Class A Common Stock,$3.58,-0.28,-7.254%,500576564.00,United States,2021,117244,Finance,Investment Managers
ALTO,Alto Ingredients Inc. Common Stock,$1.44,-0.06,-4.00%,110370420.00,United States,,576226,Industrials,Major Chemicals
ALTR,Altair Engineering Inc. Class A Common Stock,$110.37,-0.04,-0.036%,9390411051.00,United States,2017,481282,Technology,Computer Software: Prepackaged Software
ALTS,ALT5 Sigma Corporation Common Stock,$5.17,-0.57,-9.93%,72739155.00,United States,,272515,Consumer Discretionary,Home Furnishings
ALVR,AlloVir Inc. Common Stock,$9.78,0.07,0.721%,49299220.00,United States,2020,8421,Health Care,Biotechnology: Biological Products (No Diagnostic Substances)
ALXO,ALX Oncology Holdings Inc. Common Stock,$1.04,0.00,0.00%,54852828.00,United States,2020,592992,Health Care,Biotechnology: Pharmaceutical Preparations
ALZN,Alzamend Neuro Inc. Common Stock,$1.09,-0.035,-3.111%,5921749.00,United States,2021,98035,Health Care,Biotechnology: Pharmaceutical Preparations
AMAL,Amalgamated Financial Corp. Common Stock (DE),$36.13,1.02,2.905%,1108081917.00,United States,2018,222047,Finance,Major Banks
AMAT,Applied Materials Inc. Common Stock,$183.20,-0.46,-0.25%,149067025682.00,United States,1972,3907314,Technology,Semiconductors
AMBA,Ambarella Inc. Ordinary Shares,$73.29,-3.51,-4.57%,3056336135.00,United States,2012,660089,Technology,Semiconductors
AMCX,AMC Networks Inc. Class A Common Stock,$9.73,0.03,0.309%,429295180.00,United States,,347418,Telecommunications,Cable & Other Pay Television Services
AMD,Advanced Micro Devices Inc. Common Stock,$111.10,0.62,0.561%,180035101578.00,United States,,34954242,Technology,Semiconductors
AMED,Amedisys Inc Common Stock,$92.52,0.49,0.532%,3030134640.00,United States,,86928,Health Care,Medical/Nursing Services
AMGN,Amgen Inc. Common Stock,$296.66,1.87,0.634%,159464457605.00,United States,1983,3506917,Health Care,Biotechnology: Biological Products (No Diagnostic Substances)
AMIX,Autonomix Medical Inc. Common Stock,$2.66,-0.06,-2.206%,3064716.00,United States,2024,24533,Health Care,Medical/Dental Instruments
AMKR,Amkor Technology Inc. Common Stock,$21.595,-2.765,-11.351%,5325997741.00,United States,1998,5334275,Technology,Semiconductors
AMLX,Amylyx Pharmaceuticals Inc. Common Stock,$3.40,-0.34,-9.091%,233062724.00,United States,2022,656562,Health Care,Biotechnology: Pharmaceutical Preparations
AMOD,Alpha Modus Holdings Inc. Class A Common Stock,$1.89,-0.07,-3.571%,12321061.00,United States,,184652,Miscellaneous,Multi-Sector Companies
AMODW,Alpha Modus Holdings Inc. Warrant,$0.06,-0.0105,-14.894%,391145.00,United States,,72747,Miscellaneous,Multi-Sector Companies
AMPG,Amplitech Group Inc. Common Stock,$2.36,-0.20,-7.813%,26176178.00,United States,,898005,Telecommunications,Telecommunications Equipment
AMPGW,Amplitech Group Inc. Warrants,$0.8457,0.0157,1.892%,9380167.00,United States,,331,Telecommunications,Telecommunications Equipment
AMPH,Amphastar Pharmaceuticals Inc. Common Stock,$32.21,0.00,0.00%,1548702957.00,United States,2014,435624,Health Care,Biotechnology: Pharmaceutical Preparations
AMPL,Amplitude Inc. Class A Common Stock,$12.45,-0.09,-0.718%,1589660509.00,United States,,381304,Technology,Computer Software: Prepackaged Software
AMRK,A-Mark Precious Metals Inc. Common Stock,$28.73,-0.34,-1.17%,666078015.00,United States,,240641,Industrials,Other Specialty Stores
AMRX,Amneal Pharmaceuticals Inc. Class A Common Stock,$7.96,0.01,0.126%,2466361663.00,United States,,648279,Health Care,Biotechnology: Pharmaceutical Preparations
AMSC,American Superconductor Corporation Common Stock,$31.72,-0.87,-2.67%,1251662731.00,United States,1991,1475107,Consumer Discretionary,Metal Fabrications
AMSF,AMERISAFE Inc. Common Stock,$49.96,0.01,0.02%,951736501.00,United States,2005,39366,Finance,Property-Casualty Insurers
AMST,Amesite Inc. Common Stock,$3.36,0.08,2.439%,9382598.00,United States,2020,81098,Technology,Computer Software: Prepackaged Software
AMTX,Aemetis Inc. (DE) Common Stock,$2.07,-0.05,-2.358%,102950564.00,United States,,560390,Industrials,Major Chemicals
AMWD,American Woodmark Corporation Common Stock,$77.01,0.48,0.627%,1159321863.00,United States,1986,168642,Basic Materials,Forest Products
AMZN,Amazon.com Inc. Common Stock,$232.76,-0.38,-0.163%,2466727483972.00,United States,1997,23673960,Consumer Discretionary,Catalog/Specialty Distribution
ANAB,AnaptysBio Inc. Common Stock,$12.375,-0.625,-4.808%,376554940.00,United States,2017,455977,Health Care,Biotechnology: Pharmaceutical Preparations
ANDE,Andersons Inc. (The) Common Stock,$41.18,0.44,1.08%,1403002724.00,United States,,236230,Industrials,Farming/Seeds/Milling
ANEB,Anebulo Pharmaceuticals Inc. Common Stock,$1.47,0.00,0.00%,38121829.00,United States,2021,4759,Health Care,Biotechnology: Pharmaceutical Preparations
ANGI,Angi Inc. Class A Common Stock,$1.73,-0.02,-1.143%,860275429.00,United States,,805964,Consumer Discretionary,Advertising
ANGO,AngioDynamics Inc. Common Stock,$10.78,-0.07,-0.645%,436220343.00,United States,2004,336992,Health Care,Medical/Dental Instruments
ANIK,Anika Therapeutics Inc. Common Stock,$17.76,0.05,0.282%,260105785.00,United States,,58167,Health Care,Medical/Dental Instruments
ANIP,ANI Pharmaceuticals Inc.,$59.85,0.26,0.436%,1258649630.00,United States,,225486,Health Care,Biotechnology: Pharmaceutical Preparations
