Symbol,Name,Last Sale,Net Change,% Change,Market Cap (B),Country,IPO Year,Volume,Sector,Industry
UFPI,UFP Industries Inc. Common Stock,$115.67,-0.79,-0.678%,7.024021885,United States,1993.0,223820,Basic Materials,Forest Products
AMWD,American Woodmark Corporation Common Stock,$77.01,0.48,0.627%,1.159321863,United States,1986.0,168642,Basic Materials,Forest Products
IPX,IperionX Limited American Depositary Share,$26.52,0.12,0.455%,0.682213104,United States,,50560,Basic Materials,Other Metals and Minerals
EU,enCore Energy Corp. Common Shares,$2.91,0.06,2.105%,0.541517878,United States,,1091464,Basic Materials,Other Metals and Minerals
USGO,U.S. GoldMining Inc. Common stock,$12.59,1.78,16.466%,0.156677615,United States,2023.0,225247,Basic Materials,Precious Metals
USAU,U.S. Gold Corp. Common Stock,$9.11,0.2,2.245%,0.112263587,United States,,307423,Basic Materials,Metal Mining
NB,NioCorp Developments Ltd. Common Stock,$2.61,-0.01,-0.382%,0.0988929,United States,,265655,Basic Materials,Metal Mining
ABAT,American Battery Technology Company Common Stock,$1.22,-0.06,-4.688%,0.090916436,United States,,2354974,Basic Materials,Metal Mining
HYMC,Hycroft Mining Holding Corporation Class A Common Stock,$2.61,0.02,0.772%,0.064607134,United States,2018.0,248033,Basic Materials,Precious Metals
USGOW,U.S. GoldMining Inc. Warrant,$1.875,0.145,8.382%,0.02333364,United States,2023.0,48397,Basic Materials,Precious Metals
NIOBW,NioCorp Developments Ltd. Warrant,$0.1775,-0.0068,-3.69%,0.006725475,United States,,19093,Basic Materials,Metal Mining
HYMCL,Hycroft Mining Holding Corporation Warrants,$0.0188,-0.0001,-0.529%,0.000465369,United States,,28610,Basic Materials,Precious Metals
HYMCW,Hycroft Mining Holding Corporation  Warrant,$0.011,0.002,22.222%,0.000272291,United States,2018.0,35257,Basic Materials,Precious Metals
AMZN,Amazon.com Inc. Common Stock,$232.76,-0.38,-0.163%,2466.727483972,United States,1997.0,23673960,Consumer Discretionary,Catalog/Specialty Distribution
TSLA,Tesla Inc. Common Stock,$328.50,-22.23,-6.338%,1056.625846655,United States,2010.0,118024477,Consumer Discretionary,Auto Manufacturing
COST,Costco Wholesale Corporation Common Stock,$1058.34,-3.58,-0.337%,469.795930076,United States,,1747781,Consumer Discretionary,Department/Specialty Retail Stores
NFLX,Netflix Inc. Common Stock,$1008.08,-19.52,-1.90%,431.213377368,United States,2002.0,3320799,Consumer Discretionary,Consumer Electronics/Video Chains
BKNG,Booking Holdings Inc. Common Stock,$4897.32,-16.16,-0.329%,162.085194509,United States,,177354,Consumer Discretionary,Transportation Services
SBUX,Starbucks Corporation Common Stock,$111.03,-0.42,-0.377%,126.118977,United States,1992.0,4683108,Consumer Discretionary,Restaurants
CTAS,Cintas Corporation Common Stock,$205.40,1.43,0.701%,82.887923633,United States,1983.0,1093088,Consumer Discretionary,Apparel
DASH,DoorDash Inc. Class A Common Stock,$193.09,0.46,0.239%,80.208859789,United States,,6717120,Consumer Discretionary,Business Services
MAR,Marriott International Class A Common Stock,$288.00,-16.45,-5.403%,80.033308416,United States,,3055510,Consumer Discretionary,Hotels/Resorts
ORLY,O'Reilly Automotive Inc. Common Stock,$1323.94,13.92,1.063%,76.43197369,United States,1993.0,391450,Consumer Discretionary,Auto & Home Supply Stores
PYPL,PayPal Holdings Inc. Common Stock,$76.21,-2.03,-2.595%,75.390167267,United States,,15755182,Consumer Discretionary,Business Services
CPRT,Copart Inc. (DE) Common Stock,$59.23,0.6,1.023%,57.06978725,United States,1994.0,3112781,Consumer Discretionary,Retail-Auto Dealers and Gas Stations
PCAR,PACCAR Inc. Common Stock,$106.09,-0.02,-0.019%,55.623045774,United States,,1203672,Consumer Discretionary,Auto Manufacturing
PAYX,Paychex Inc. Common Stock,$146.10,-0.91,-0.619%,52.605215111,United States,1983.0,1404130,Consumer Discretionary,Diversified Commercial Services
ROST,Ross Stores Inc. Common Stock,$141.27,-0.86,-0.605%,46.60909766,United States,1985.0,2704129,Consumer Discretionary,Clothing/Shoe/Accessory Stores
GSAT,Globalstar Inc. Common Stock,$24.33,0.9298,3.973%,46.041444335,United States,2006.0,1581105,Consumer Discretionary,Telecommunications Equipment
FAST,Fastenal Company Common Stock,$74.33,0.61,0.827%,42.622286598,United States,1987.0,1480183,Consumer Discretionary,RETAIL: Building Materials
UAL,United Airlines Holdings Inc. Common Stock,$103.31,-2.77,-2.611%,33.976169229,United States,,7283085,Consumer Discretionary,Air Freight/Delivery Services
EBAY,eBay Inc. Common Stock,$68.46,0.2,0.293%,32.79234,United States,1998.0,3615487,Consumer Discretionary,Business Services
CSGP,CoStar Group Inc. Common Stock,$76.00,-0.97,-1.26%,31.156923292,United States,1998.0,1975335,Consumer Discretionary,Business Services
PEP,PepsiCo Inc. Common Stock,$145.64,1.29,0.894%,199.745236406,United States,,6352770,Consumer Staples,Beverages (Production/Distribution)
MDLZ,Mondelez International Inc. Class A Common Stock,$60.45,1.92,3.28%,78.193596345,United States,,12174666,Consumer Staples,Packaged Foods
MNST,Monster Beverage Corporation,$48.06,0.25,0.523%,46.739294812,United States,,3141095,Consumer Staples,Beverages (Production/Distribution)
KDP,Keurig Dr Pepper Inc. Common Stock,$31.56,0.66,2.136%,42.809677162,United States,,7698746,Consumer Staples,Beverages (Production/Distribution)
KHC,The Kraft Heinz Company Common Stock,$29.58,0.62,2.141%,35.767393365,United States,,9258873,Consumer Staples,Packaged Foods
SFM,Sprouts Farmers Market Inc. Common Stock,$166.13,-2.77,-1.64%,16.611553672,United States,2013.0,1260940,Consumer Staples,Food Chains
PPC,Pilgrim's Pride Corporation Common Stock,$52.55,1.05,2.039%,12.460816856,United States,,1711924,Consumer Staples,Meat/Poultry/Fish
COKE,Coca-Cola Consolidated Inc. Common Stock,$1415.40,12.98,0.926%,12.399865057,United States,1972.0,33036,Consumer Staples,Beverages (Production/Distribution)
CPB,The Campbell's Company Common Stock,$37.95,0.56,1.498%,11.31324581,United States,,2385164,Consumer Staples,Packaged Foods
SFD,Smithfield Foods Inc. Common Stock,$21.26,0.0,0.00%,8.450195872,United States,2025.0,594473,Consumer Staples,Meat/Poultry/Fish
WBA,Walgreens Boots Alliance Inc. Common Stock,$9.36,-0.61,-6.118%,8.08847646,United States,,22869302,Consumer Staples,Retail-Drug Stores and Proprietary Stores
FRPT,Freshpet Inc. Common Stock,$130.75,0.4,0.307%,6.346183854,United States,2014.0,1919910,Consumer Staples,Packaged Foods
CALM,Cal-Maine Foods Inc. Common Stock,$113.98,4.57,4.177%,5.589019216,United States,1996.0,725815,Consumer Staples,Farming/Seeds/Milling
LANC,Lancaster Colony Corporation Common Stock,$190.67,4.09,2.192%,5.25715324,United States,,117785,Consumer Staples,Packaged Foods
CELH,Celsius Holdings Inc. Common Stock,$22.04,0.36,1.661%,5.180093202,United States,,5364986,Consumer Staples,Beverages (Production/Distribution)
FIZZ,National Beverage Corp. Common Stock,$39.87,-0.39,-0.969%,3.732415936,United States,,144885,Consumer Staples,Beverages (Production/Distribution)
JJSF,J & J Snack Foods Corp. Common Stock,$127.07,1.98,1.583%,2.476626576,United States,1986.0,120435,Consumer Staples,Specialty Foods
COCO,The Vita Coco Company Inc. Common Stock,$39.42,0.04,0.102%,2.236373035,United States,2021.0,813920,Consumer Staples,Beverages (Production/Distribution)
GO,Grocery Outlet Holding Corp. Common Stock,$16.90,-0.47,-2.706%,1.641604569,United States,2019.0,2141853,Consumer Staples,Food Chains
SONO,Sonos Inc. Common Stock,$13.23,-0.57,-4.13%,1.575463631,United States,2018.0,2811412,Consumer Staples,Consumer Electronics/Appliances
FANG,Diamondback Energy Inc. Common Stock,$162.01,0.35,0.217%,47.30516932,United States,2012.0,1722304,Energy,Oil & Gas Production
EXE,Expand Energy Corporation Common Stock,$105.785,0.665,0.633%,24.440015366,United States,,2620411,Energy,Oil & Gas Production
EXEEW,Expand Energy Corporation Class A Warrants,$99.10,0.0,0.00%,22.895547788,United States,,1,Energy,Oil & Gas Production
EXEEZ,Expand Energy Corporation Class B Warrants,$97.16,1.02,1.061%,22.447340294,United States,,7507,Energy,Oil & Gas Production
EXEEL,Expand Energy Corporation Class C Warrants,$93.00,0.71,0.769%,21.486235563,United States,,284,Energy,Oil & Gas Production
PAA,Plains All American Pipeline L.P. Common Units representing Limited Partner Interests,$19.72,-0.03,-0.152%,13.876353843,United States,1998.0,2483496,Energy,Natural Gas Distribution
WWD,Woodward Inc. Common Stock,$193.27,0.18,0.093%,11.472484587,United States,,362678,Energy,Industrial Machinery/Components
VNOM,Viper Energy Inc. Class A Common Stock,$51.14,0.54,1.067%,9.635215548,United States,2014.0,1377097,Energy,Oil & Gas Production
APA,APA Corporation Common Stock,$23.31,0.32,1.392%,8.623475129,United States,,6491045,Energy,Oil & Gas Production
CHRD,Chord Energy Corporation Common Stock,$114.41,1.24,1.096%,6.99393753,United States,,746247,Energy,Oil & Gas Production
LFUS,Littelfuse Inc. Common Stock,$239.72,5.0,2.13%,5.948576768,United States,,194030,Energy,Electrical Products
PAGP,Plains GP Holdings L.P. Class A Units representing Limited Partner Interests,$20.93,-0.12,-0.57%,4.13295708,United States,,1397395,Energy,Natural Gas Distribution
PTEN,Patterson-UTI Energy Inc. Common Stock,$9.23,0.25,2.784%,3.599298061,United States,1993.0,12145960,Energy,Oil & Gas Production
ARLP,Alliance Resource Partners L.P. Common Units representing Limited Partners Interests,$26.46,0.08,0.303%,3.388520017,United States,1999.0,316649,Energy,Coal Mining
MGEE,MGE Energy Inc,$90.06,0.48,0.536%,3.260850062,United States,,112730,Energy,Electric Utilities: Central
POWL,Powell Industries Inc. Common Stock,$210.25,-9.64,-4.384%,2.536608011,United States,,588577,Energy,Electrical Products
HPK,HighPeak Energy Inc. Common Stock,$14.91,0.59,4.12%,1.887982045,United States,,272317,Energy,Oil & Gas Production
DMLP,Dorchester Minerals L.P. Common Units Representing Limited Partnership Interests,$32.025,0.065,0.203%,1.516055686,United States,,166631,Energy,Oil & Gas Production
PLUG,Plug Power Inc. Common Stock,$1.62,-0.1,-5.814%,1.476139036,United States,1999.0,52404363,Energy,Industrial Machinery/Components
METCL,Ramaco Resources Inc. 9.00% Senior Notes due 2026,$25.71,0.0,0.00%,1.371401506,United States,,1716,Energy,Coal Mining
CME,CME Group Inc. Class A Common Stock,$241.74,-0.07,-0.029%,87.11395847,United States,2002.0,1358997,Finance,Investment Bankers/Brokers/Service
ABNB,Airbnb Inc. Class A Common Stock,$134.52,-0.72,-0.532%,85.281865013,United States,2020.0,4041294,Finance,Diversified Commercial Services
COIN,Coinbase Global Inc. Class A Common Stock,$266.90,-13.32,-4.753%,66.818533237,United States,,6875851,Finance,Finance: Consumer Services
HOOD,Robinhood Markets Inc. Class A Common Stock,$53.34,-2.93,-5.207%,47.151263251,United States,2021.0,24062718,Finance,Investment Bankers/Brokers/Service
NDAQ,Nasdaq Inc. Common Stock,$80.29,-0.92,-1.133%,46.147288025,United States,,2497954,Finance,Investment Bankers/Brokers/Service
HBANL,Huntington Bancshares Incorporated Depositary Shares Each Representing a 1/40th Interest in a Share of 6.875% Series J Non-Cumulative Perpetual Preferred Stock,$25.44,-0.03,-0.118%,36.959521812,United States,,22198,Finance,Major Banks
HBANM,Huntington Bancshares Incorporated Depositary Shares each representing a 1/1000th interest in a share of Huntington Series I Preferred Stock,$22.62,0.01,0.044%,32.862593687,United States,,16297,Finance,Major Banks
FCNCA,First Citizens BancShares Inc. Class A Common Stock,$2155.94,1.37,0.064%,30.16051185,United States,,49184,Finance,Major Banks
FITB,Fifth Third Bancorp Common Stock,$44.00,0.67,1.546%,29.503905728,United States,,3676147,Finance,Major Banks
LPLA,LPL Financial Holdings Inc. Common Stock,$362.42,-3.68,-1.005%,27.137857021,United States,2010.0,880973,Finance,Investment Bankers/Brokers/Service
HBANP,Huntington Bancshares Incorporated Depositary Shares 4.500% Series H Non-Cumulative Perpetual Preferred Stock,$18.07,-0.03,-0.166%,26.252301853,United States,,21985,Finance,Major Banks
AFRM,Affirm Holdings Inc. Class A Common Stock,$78.02,0.27,0.347%,24.814764229,United States,2021.0,8486167,Finance,Finance: Consumer Services
HBAN,Huntington Bancshares Incorporated Common Stock,$16.86,0.13,0.777%,24.494400069,United States,,18784261,Finance,Major Banks
TROW,T. Rowe Price Group Inc. Common Stock,$109.03,-0.59,-0.538%,24.222047014,United States,1986.0,1040988,Finance,Investment Bankers/Brokers/Service
IBKR,Interactive Brokers Group Inc. Class A Common Stock,$221.47,-4.72,-2.087%,24.113449626,United States,2019.0,1434345,Finance,Investment Bankers/Brokers/Service
TPG,TPG Inc. Class A Common Stock,$60.79,-1.59,-2.549%,22.186396027,United States,2022.0,1408921,Finance,Investment Managers
NTRS,Northern Trust Corporation Common Stock,$110.42,-0.58,-0.523%,21.887284893,United States,,1809180,Finance,Major Banks
CINF,Cincinnati Financial Corporation Common Stock,$139.43,3.81,2.809%,21.795014672,United States,,1374158,Finance,Property-Casualty Insurers
PFG,Principal Financial Group Inc Common Stock,$85.45,1.07,1.268%,19.544624993,United States,2001.0,1952325,Finance,Accident &Health Insurance
ERIE,Erie Indemnity Company Class A Common Stock,$396.75,-7.68,-1.899%,18.326521268,United States,,111462,Finance,Specialty Insurers
ISRG,Intuitive Surgical Inc. Common Stock,$591.65,-4.05,-0.68%,211.016092751,United States,2000.0,837053,Health Care,Industrial Specialties
AMGN,Amgen Inc. Common Stock,$296.66,1.87,0.634%,159.464457605,United States,1983.0,3506917,Health Care,Biotechnology: Biological Products (No Diagnostic Substances)
GILD,Gilead Sciences Inc. Common Stock,$96.14,0.66,0.691%,119.815999492,United States,1992.0,6256940,Health Care,Biotechnology: Biological Products (No Diagnostic Substances)
VRTX,Vertex Pharmaceuticals Incorporated Common Stock,$455.22,-14.75,-3.138%,117.232483394,United States,1991.0,1560952,Health Care,Biotechnology: Pharmaceutical Preparations
REGN,Regeneron Pharmaceuticals Inc. Common Stock,$665.46,-24.9,-3.607%,72.751202884,United States,1991.0,1270766,Health Care,Biotechnology: Pharmaceutical Preparations
GEHC,GE HealthCare Technologies Inc. Common Stock ,$87.03,-0.47,-0.537%,39.761655362,United States,,2392445,Health Care,Medical Electronics
IDXX,IDEXX Laboratories Inc. Common Stock,$463.74,-1.17,-0.252%,37.973194083,United States,1991.0,516829,Health Care,Biotechnology: In Vitro & In Vivo Diagnostic Substances
ALNY,Alnylam Pharmaceuticals Inc. Common Stock,$268.99,-5.07,-1.85%,34.694576864,United States,2004.0,283048,Health Care,Biotechnology: Pharmaceutical Preparations
DXCM,DexCom Inc. Common Stock,$86.38,-1.89,-2.141%,33.739629788,United States,2005.0,2585946,Health Care,Medical/Dental Instruments
NTRA,Natera Inc. Common Stock,$169.71,-2.48,-1.44%,22.405252683,United States,2015.0,1553275,Health Care,Medical Specialities
BIIB,Biogen Inc. Common Stock,$139.39,-3.15,-2.21%,20.311818803,United States,,1908950,Health Care,Biotechnology: Biological Products (No Diagnostic Substances)
PODD,Insulet Corporation Common Stock,$284.26,-1.08,-0.378%,19.939353742,United States,2007.0,417009,Health Care,Medical/Dental Instruments
RPRX,Royalty Pharma plc Class A Ordinary Shares ,$32.25,0.53,1.671%,19.001144752,United States,2020.0,7664922,Health Care,Biotechnology: Pharmaceutical Preparations
COO,The Cooper Companies Inc. Common Stock,$93.45,-0.18,-0.192%,18.6509964,United States,,681671,Health Care,Ophthalmic Goods
ILMN,Illumina Inc. Common Stock,$100.68,-4.31,-4.105%,15.967848,United States,2000.0,4267048,Health Care,Medical Specialities
UTHR,United Therapeutics Corporation Common Stock,$353.31,7.67,2.219%,15.773355008,United States,1999.0,508279,Health Care,Biotechnology: Pharmaceutical Preparations
ALGN,Align Technology Inc. Common Stock,$210.52,-1.51,-0.712%,15.715962191,United States,2001.0,650671,Health Care,Industrial Specialties
HOLX,Hologic Inc. Common Stock,$64.47,-0.77,-1.18%,14.466398286,United States,1990.0,2107346,Health Care,Medical Electronics
INSM,Insmed Incorporated Common Stock,$79.89,1.77,2.266%,14.292538381,United States,,1458000,Health Care,Biotechnology: Pharmaceutical Preparations
SMMT,Summit Therapeutics Inc. Common Stock ,$19.08,-1.42,-6.927%,14.070510626,United States,2015.0,1916792,Health Care,Biotechnology: Pharmaceutical Preparations
LIN,Linde plc Ordinary Shares,$460.74,-0.12,-0.026%,219.384992228,United States,,1587763,Industrials,Major Chemicals
HON,Honeywell International Inc. Common Stock,$206.94,-1.58,-0.758%,134.562192817,United States,,3077232,Industrials,Aerospace
CSX,CSX Corporation Common Stock,$33.11,0.03,0.091%,63.849958156,United States,,9176496,Industrials,Railroads
ROP,Roper Technologies Inc. Common Stock,$581.35,6.83,1.189%,62.337666934,United States,1992.0,552398,Industrials,Industrial Machinery/Components
AXON,Axon Enterprise Inc. Common Stock,$669.26,-8.59,-1.267%,51.034271386,United States,2001.0,421465,Industrials,Ordnance And Accessories
BKR,Baker Hughes Company Class A Common Stock,$47.11,-0.07,-0.148%,46.644169442,United States,,5240411,Industrials,Metal Fabrications
ODFL,Old Dominion Freight Line Inc. Common Stock,$205.77,3.99,1.977%,43.931387983,United States,1991.0,1956922,Industrials,Trucking Freight/Courier Services
FWONK,Liberty Media Corporation Series C Liberty Formula One Common Stock,$100.07,0.52,0.522%,24.88802353,United States,,643286,Industrials,Broadcasting
FOXA,Fox Corporation Class A Common Stock,$53.39,0.14,0.263%,24.208513339,United States,,2290019,Industrials,Broadcasting
FWONA,Liberty Media Corporation Series A Liberty Formula One Common Stock,$92.72,0.72,0.783%,23.060033394,United States,,52601,Industrials,Broadcasting
FOX,Fox Corporation Class B Common Stock,$50.55,0.2,0.397%,22.920778222,United States,,524404,Industrials,Broadcasting
STLD,Steel Dynamics Inc.,$134.86,1.99,1.498%,20.531760026,United States,1996.0,2616402,Industrials,Steel/Iron Ore
TER,Teradyne Inc. Common Stock,$112.72,-1.34,-1.175%,18.357743997,United States,,1697330,Industrials,Electrical Products
ZBRA,Zebra Technologies Corporation Class A Common Stock,$354.40,-4.04,-1.127%,18.279961923,United States,1991.0,951090,Industrials,Industrial Machinery/Components
TRMB,Trimble Inc. Common Stock,$73.83,-0.53,-0.713%,18.146827347,United States,1990.0,830706,Industrials,Industrial Machinery/Components
SYM,Symbotic Inc. Class A Common Stock,$29.14,0.95,3.37%,17.145737052,United States,2021.0,2112291,Industrials,Industrial Machinery/Components
JBHT,J.B. Hunt Transport Services Inc. Common Stock,$167.50,0.4,0.239%,16.889017295,United States,,653393,Industrials,Trucking Freight/Courier Services
ENTG,Entegris Inc. Common Stock,$105.74,-0.99,-0.928%,15.966524396,United States,2000.0,1975015,Industrials,Plastic Products
PARAA,Paramount Global Class A Common Stock,$22.30,-0.08,-0.357%,14.873546425,United States,,19067,Industrials,Broadcasting
RKLB,Rocket Lab USA Inc. Common Stock,$28.22,-2.38,-7.778%,14.107490621,United States,2020.0,20175358,Industrials,Military/Government/Technical
IDCC,InterDigital Inc. Common Stock,$207.62,0.57,0.275%,5.332520592,United States,,479444,Miscellaneous,Multi-Sector Companies
NOVT,Novanta Inc. Common Stock,$146.53,-1.13,-0.765%,5.263552192,United States,,127988,Miscellaneous,Industrial Machinery/Components
ENVX,Enovix Corporation Common Stock,$10.57,-1.22,-10.348%,1.881219046,United States,2021.0,7599525,Miscellaneous,Industrial Machinery/Components
RUN,Sunrun Inc. Common Stock,$8.10,-0.26,-3.11%,1.817148929,United States,2015.0,8420778,Miscellaneous,Industrial Machinery/Components
FLNC,Fluence Energy Inc. Class A Common Stock,$7.00,-6.07,-46.442%,1.267843318,United States,2021.0,53145067,Miscellaneous,Industrial Machinery/Components
EOSE,Eos Energy Enterprises Inc. Class A Common Stock,$4.91,-0.49,-9.074%,1.069949693,United States,,12392189,Miscellaneous,Industrial Machinery/Components
CTLP,Cantaloupe Inc. Common Stock,$10.53,0.6,6.042%,0.769054075,United States,,1247252,Miscellaneous,Office Equipment/Supplies/Services
BYRN,Byrna Technologies Inc. Common Stock,$32.33,-1.86,-5.44%,0.732175118,United States,,833513,Miscellaneous,Industrial Machinery/Components
MVST,Microvast Holdings Inc. Common Stock,$1.79,0.11,6.548%,0.579629383,United States,2019.0,9350708,Miscellaneous,Industrial Machinery/Components
APPS,Digital Turbine Inc. Common Stock,$5.45,0.07,1.301%,0.572287109,United States,,9508976,Miscellaneous,Multi-Sector Companies
ACTG,Acacia Research Corporation (Acacia Tech) Common Stock,$4.25,0.0,0.00%,0.413814701,United States,,67398,Miscellaneous,Multi-Sector Companies
SLDP,Solid Power Inc. Class A Common Stock,$1.31,-0.02,-1.504%,0.236307846,United States,2021.0,1711720,Miscellaneous,Industrial Machinery/Components
JYNT,The Joint Corp. Common Stock,$11.56,0.02,0.173%,0.17321052,United States,2014.0,38965,Miscellaneous,Multi-Sector Companies
EOSEW,Eos Energy Enterprises Inc. Warrant,$0.72,-0.23,-24.211%,0.1568969,United States,,366829,Miscellaneous,Industrial Machinery/Components
ULBI,Ultralife Corporation Common Stock,$7.45,-0.37,-4.731%,0.123870629,United States,1992.0,60167,Miscellaneous,Industrial Machinery/Components
MVSTW,Microvast Holdings Inc. Warrants,$0.35,0.0351,11.146%,0.113335354,United States,2019.0,247495,Miscellaneous,Industrial Machinery/Components
ZEO,Zeo Energy Corporation Class A Common Stock,$2.25,-0.03,-1.316%,0.110839151,United States,2021.0,42801,Miscellaneous,Industrial Machinery/Components
NEOV,NeoVolta Inc. Common Stock,$3.10,0.07,2.31%,0.103593081,United States,,427916,Miscellaneous,Industrial Machinery/Components
LASE,Laser Photonics Corporation Common Stock,$3.99,-0.09,-2.206%,0.055191256,United States,2022.0,256326,Miscellaneous,Industrial Machinery/Components
REFR,Research Frontiers Incorporated Common Stock,$1.56,0.16,11.429%,0.052287748,United States,,53023,Miscellaneous,Multi-Sector Companies
EQIX,Equinix Inc. Common Stock REIT,$943.64,0.5,0.053%,91.050112781,United States,2000.0,437783,Real Estate,Real Estate Investment Trusts
AGNCN,AGNC Investment Corp. Depositary Shares Each Representing a 1/1000th Interest in a Share of 7.00% Series C Fixed-To-Floating Rate Cumulative Redeemable Preferred Stock,$25.69,-0.01,-0.039%,22.75208731,United States,,15541,Real Estate,Real Estate Investment Trusts
SBAC,SBA Communications Corporation Class A Common Stock,$209.24,2.93,1.42%,22.498032172,United States,1999.0,526293,Real Estate,Real Estate Investment Trusts
AGNCO,AGNC Investment Corp. Depositary Shares each representing a 1/1000th interest in a share of 6.50% Series E Fixed-to-Floating Cumulative Redeemable Preferred Stock,$25.38,0.01,0.039%,22.477538962,United States,,14863,Real Estate,Real Estate Investment Trusts
AGNCM,AGNC Investment Corp. Depositary Shares rep 6.875% Series D Fixed-to-Floating Cumulative Redeemable Preferred Stock,$25.1586,0.0286,0.114%,22.281458303,United States,,10693,Real Estate,Real Estate Investment Trusts
AGNCP,AGNC Investment Corp. Depositary Shares Each Representing a 1/1000th Interest in a Share of 6.125% Series F Fixed-to-Floating Rate Cumulative Redeemable Preferred Stock,$24.97,0.02,0.08%,22.11442663,United States,,24705,Real Estate,Real Estate Investment Trusts
AGNCL,AGNC Investment Corp. Depositary Shares Each Representing a 1/1000th Interest in a Share of 7.75% Series G Fixed-Rate Reset Cumulative Redeemable Preferred Stock,$24.80,0.17,0.69%,21.963867858,United States,,17902,Real Estate,Real Estate Investment Trusts
REG,Regency Centers Corporation Common Stock,$74.42,0.81,1.10%,13.50763157,United States,1993.0,950985,Real Estate,Real Estate Investment Trusts
GLPI,Gaming and Leisure Properties Inc. Common Stock,$48.76,-0.32,-0.652%,13.379332124,United States,,880759,Real Estate,Real Estate Investment Trusts
LINE,Lineage Inc. Common Stock,$57.50,0.15,0.262%,13.133674475,United States,2024.0,599120,Real Estate,Real Estate Investment Trusts
LAMR,Lamar Advertising Company Class A Common Stock,$126.75,-1.43,-1.116%,12.973852037,United States,1996.0,347748,Real Estate,Real Estate Investment Trusts
HST,Host Hotels & Resorts Inc. Common Stock,$16.49,-0.06,-0.363%,11.526992728,United States,,4612893,Real Estate,Real Estate Investment Trusts
AGNC,AGNC Investment Corp. Common Stock,$10.18,0.04,0.394%,9.0158135,United States,2008.0,20213948,Real Estate,Real Estate Investment Trusts
LOPE,Grand Canyon Education Inc. Common Stock,$182.00,0.2,0.11%,5.304532142,United States,2008.0,184476,Real Estate,Other Consumer Services
PECO,Phillips Edison & Company Inc. Common Stock,$37.12,0.3,0.815%,4.550912,United States,2021.0,602396,Real Estate,Real Estate Investment Trusts
REGCP,Regency Centers Corporation 6.25% Series A Cumulative Redeemable Preferred Stock,$23.20,0.16,0.694%,4.210925187,United States,,20102,Real Estate,Real Estate Investment Trusts
REGCO,Regency Centers Corporation 5.875% Series B Cumulative Redeemable Preferred Stock,$22.29,0.14,0.632%,4.045755277,United States,,11048,Real Estate,Real Estate Investment Trusts
DHCNL,Diversified Healthcare Trust 6.25% Senior Notes Due 2046,$16.57,0.12,0.729%,3.997932931,United States,,11402,Real Estate,Real Estate Investment Trusts
SBRA,Sabra Health Care REIT Inc. Common Stock,$16.24,-0.39,-2.345%,3.842169713,United States,,3180393,Real Estate,Real Estate Investment Trusts
DHCNI,Diversified Healthcare Trust 5.625% Senior Notes due 2042,$14.75,0.13,0.889%,3.558811752,United States,,24763,Real Estate,Real Estate Investment Trusts
AAPL,Apple Inc. Common Stock,$232.62,4.97,2.183%,3494.43462126,United States,1980.0,53677039,Technology,Computer Manufacturing
NVDA,NVIDIA Corporation Common Stock,$132.80,-0.77,-0.576%,3252.272,United States,1999.0,178309816,Technology,Semiconductors
MSFT,Microsoft Corporation Common Stock,$411.44,-0.78,-0.189%,3058.637650768,United States,1986.0,18122243,Technology,Computer Software: Prepackaged Software
GOOG,Alphabet Inc. Class C Capital Stock,$187.07,-1.13,-0.60%,2280.3833,United States,2004.0,13009209,Technology,Computer Software: Programming Data Processing
